195, DXC, DXC Technology Company, Technology, Information Technology Services, USA, 9.77B, 8.91, -, 0.55, 1.94, -, 97.10%, 20.92%, -8.82%, 77.10%, -8.90%, -0.60%, -3.00%, 1.10%, 1.00, 1.00, 0.87, 1.11, 20.50%, 5.20%, -0.80%, 13.43%, 46.07%, 60.95%, 166.85%, 47.26%, 3.31%
197, EB, Eventbrite Inc., Technology, Software - Application, USA, 1.92B, -, -, 22.72, 10.30, -, -199.90%, 65.80%, 46.40%, 46.40%, -43.40%, -19.40%, -56.80%, -38.00%, 2.00, 2.00, 1.92, 0.00, 43.40%, -, -, -14.49%, -5.76%, 20.12%, 135.50%, 12.15%, 5.44%
199, EBON, Ebang International Holdings Inc., Technology, Computer Hardware, China, 402.32M, -, -, 21.17, -, -, -, -, -, -, -93.00%, -, -, -, -, -, -, -, -, -, -, -30.02%, -63.78%, -43.88%, -, -52.39%, 11.35%
202, EGAN, eGain Corporation, Technology, Software - Application, USA, 296.98M, 52.29, 4.61, 3.85, 7.33, 29.40, 64.30%, -9.86%, 10.00%, -33.80%, 7.10%, 7.60%, 18.10%, 19.20%, 1.60, 1.60, 0.00, 0.00, 75.10%, 10.80%, 9.20%, 1.21%, -13.22%, -12.16%, -3.55%, -14.99%, 6.01%
204, ELSE, Electro-Sensors Inc., Technology, Scientific & Technical Instruments, USA, 15.50M, -, -, 2.04, 1.21, -, -166.40%, -, -, 97.80%, 0.00%, -0.30%, -0.30%, -1.20%, 17.60, 15.40, 0.00, 0.00, 51.60%, -0.90%, -0.50%, 3.40%, -18.72%, 7.04%, 24.93%, -5.20%, 6.62%
206, EMAN, eMagin Corporation, Technology, Semiconductor Equipment & Materials, USA, 192.19M, -, -, 6.51, 20.35, -, -112.10%, 58.80%, 20.00%, -296.00%, 1.50%, -42.00%, -103.60%, -21.00%, 1.40, 1.00, 0.82, 0.90, 22.50%, -18.80%, -59.20%, 47.46%, -9.96%, 260.18%, 674.65%, 146.67%, 9.17%
208, ENPH, Enphase Energy Inc., Technology, Solar, USA, 19.31B, 53.42, 5.59, 22.18, 25.64, 85.49, -22.90%, 34.98%, 41.67%, -56.60%, 46.90%, 7.10%, 19.30%, 24.70%, 5.20, 5.10, 1.25, 1.37, 44.60%, 16.90%, 11.10%, -0.24%, -23.28%, 2.86%, 145.83%, -18.48%, 5.74%
210, ENV, Envestnet Inc., Technology, Software - Application, USA, 3.88B, 31.08, 13.83, 3.78, 4.27, 20.05, 82.40%, 8.89%, 15.00%, 295.40%, 11.60%, 0.90%, 2.10%, 1.40%, 2.10, 2.10, 0.92, 0.00, 68.50%, 4.30%, 1.90%, -3.04%, 6.12%, -9.36%, -0.88%, -12.54%, 2.87%
212, EPAY, Bottomline Technologies de Inc., Technology, Software - Infrastructure, USA, 1.71B, 30.12, -, 3.72, 3.64, 30.00, -197.70%, 7.35%, 40.00%, 37.70%, 8.20%, -1.50%, -2.80%, -0.90%, 1.60, 1.60, 0.30, 0.30, 58.10%, -0.70%, -2.60%, -24.67%, -15.81%, -19.37%, -26.13%, -29.12%, 3.22%
214, ESE, ESCO Technologies Inc., Technology, Scientific & Technical Instruments, USA, 2.46B, 25.53, 6.17, 3.47, 2.48, 28.89, -67.20%, 22.95%, 15.00%, -8.90%, -7.70%, 2.00%, 2.80%, 3.00%, 1.70, 1.10, 0.03, 0.05, 38.10%, 7.40%, 3.90%, -15.10%, -12.73%, -5.41%, 14.56%, -8.31%, 2.43%
216, ETWO, E2open Parent Holdings Inc., Technology, Software - Infrastructure, USA, 2.89B, 95.79, -, 35.71, 1.43, 212.70, -134.30%, 209.30%, -, -, -, -3.20%, -5.00%, -0.90%, 1.80, 1.80, 0.24, 0.25, 52.60%, -, -50.60%, 15.50%, 30.40%, 24.90%, -, 17.53%, 6.30%
218, EVOL, Evolving Systems Inc., Technology, Software - Application, USA, 22.70M, -, -, 0.86, 2.49, 7.32, 106.60%, -, 15.00%, -, 3.20%, -1.30%, -2.70%, 1.50%, 1.50, 1.50, 0.03, 0.03, 66.30%, 4.00%, -0.90%, -17.98%, -37.87%, 15.43%, 85.15%, -5.08%, 8.73%
220, EVTC, EVERTEC Inc., Technology, Software - Infrastructure, USA, 3.15B, 17.18, 2.79, 5.96, 8.94, 19.24, 1.50%, 9.46%, 9.68%, 59.70%, 14.40%, 11.30%, 37.10%, 14.70%, 2.30, 2.30, 1.30, 1.35, 56.00%, 29.10%, 22.30%, 3.13%, 18.42%, 15.01%, 49.48%, 10.71%, 2.54%
201, EEFT, Euronet Worldwide Inc., Technology, Software - Infrastructure, USA, 7.91B, 17.84, -, 3.10, 5.62, 57.69, -101.10%, 70.23%, 15.00%, -568.30%, 11.80%, -0.30%, -1.00%, 1.20%, 1.80, 1.80, 0.81, 0.82, 35.30%, 1.00%, -0.50%, 2.07%, -2.29%, 9.33%, 57.96%, 3.26%, 2.74%
203, EGHT, 8x8 Inc., Technology, Software - Application, USA, 2.63B, 125.94, -, 4.94, 15.81, -, 9.10%, 266.67%, -, 14.40%, 19.10%, -24.10%, -97.20%, -31.30%, 2.30, 2.30, 1.92, 1.92, 56.80%, -27.50%, -31.10%, -29.36%, -32.81%, 16.01%, 61.97%, -31.68%, 4.07%
205, ELTK, Eltek Ltd., Technology, Electronic Components, Israel, 33.30M, -, -, 0.91, 2.33, 10.74, 20.70%, -, -, 107.60%, -21.70%, -, -, 16.90%, 2.00, 1.60, 0.09, 0.12, 21.10%, -, -, 3.28%, 4.36%, 24.79%, 37.39%, 19.09%, 10.90%
207, EMKR, EMCORE Corporation, Technology, Semiconductors, USA, 357.35M, 12.71, 3.37, 2.69, 2.75, 198.53, 81.30%, 19.22%, 15.00%, 172.70%, 60.70%, 4.70%, 7.50%, -8.80%, 4.60, 3.50, 0.04, 0.06, 36.90%, 4.90%, 4.80%, 47.42%, 32.33%, 137.75%, 220.13%, 77.98%, 7.33%
209, ENTG, Entegris Inc., Technology, Semiconductor Equipment & Materials, USA, 15.43B, 30.37, 2.61, 7.87, 10.83, 52.74, 16.00%, 18.16%, 18.72%, 38.70%, 24.40%, 11.10%, 23.90%, 13.50%, 4.70, 3.30, 0.76, 0.00, 45.90%, 21.80%, 16.30%, -0.40%, 4.38%, 28.65%, 91.13%, 19.09%, 3.45%
211, EPAM, EPAM Systems Inc., Technology, Information Technology Services, USA, 26.61B, 49.92, 3.53, 9.54, 13.00, 60.06, 23.70%, 23.43%, 22.63%, 26.10%, 19.90%, 13.40%, 18.30%, 16.30%, 4.30, 4.30, 0.01, 0.01, 34.50%, 14.30%, 12.60%, 4.05%, 24.16%, 49.88%, 107.08%, 33.28%, 2.28%
213, ERIC, Telefonaktiebolaget LM Ericsson publ, Technology, Communication Equipment, Sweden, 44.26B, 15.42, 1.23, 1.58, 4.12, 20.87, 682.40%, 16.44%, 16.21%, 47.30%, 0.10%, 6.80%, 21.90%, 14.40%, 1.30, 1.00, 0.34, 0.39, 41.20%, 12.40%, 8.00%, -3.87%, 5.00%, 9.54%, 46.94%, 12.38%, 1.43%
215, ESTC, Elastic N.V., Technology, Software - Application, USA, 10.64B, -, -, 19.20, 22.91, 729.02, -13.80%, -182.40%, 2.80%, 21.60%, 38.80%, -13.80%, -26.90%, -40.90%, 1.50, 1.50, 0.00, 0.00, 73.00%, -22.90%, -21.20%, -4.38%, -18.39%, -0.81%, 37.58%, -19.11%, 5.06%
217, EVBG, Everbridge Inc., Technology, Software - Application, USA, 4.45B, 3790.32, -, 15.09, 11.99, 146.70, -71.40%, 118.80%, -, 19.60%, 39.60%, -8.80%, -33.00%, -10.10%, 3.30, 3.30, 1.79, 1.79, 70.30%, -24.50%, -30.50%, -12.36%, -25.79%, -5.37%, -19.66%, -21.18%, 5.03%
219, EVOP, EVO Payments Inc., Technology, Software - Infrastructure, USA, 2.32B, 28.78, -, 5.35, -, 17.29, 36.70%, 21.49%, 20.25%, 40.50%, -4.50%, -0.40%, 1.10%, -5.50%, 1.30, 1.30, -, -, 82.00%, 7.10%, -1.50%, -1.68%, 11.66%, 11.61%, 29.36%, 6.03%, 3.42%
222, EXLS, ExlService Holdings Inc., Technology, Information Technology Services, USA, 3.42B, 23.03, 3.30, 3.51, 4.74, 18.06, 32.90%, 5.91%, 10.75%, 44.10%, 6.30%, 8.10%, 14.00%, 8.90%, 3.00, 3.00, 0.28, 0.31, 36.30%, 12.70%, 10.20%, 7.77%, 19.78%, 21.48%, 66.72%, 19.79%, 2.59%
224, FARO, FARO Technologies Inc., Technology, Scientific & Technical Instruments, USA, 1.38B, 33.43, 3.96, 4.59, 3.90, -, 101.00%, 124.50%, 30.00%, 78.80%, -4.00%, 2.50%, 3.70%, 0.20%, 3.30, 2.80, 0.00, 0.00, 52.00%, -6.80%, 4.10%, -7.09%, -21.28%, 14.09%, 34.42%, 7.11%, 3.22%
226, FEYE, FireEye Inc., Technology, Software - Infrastructure, USA, 5.28B, 48.00, -, 5.49, 7.33, 45.73, 23.20%, 16.50%, -, 32.80%, 9.60%, -6.50%, -27.70%, -9.30%, 2.10, 2.10, 1.36, 0.00, 65.00%, -13.40%, -19.90%, 10.80%, 10.80%, 47.95%, 79.25%, -2.99%, 3.65%
228, FICO, Fair Isaac Corporation, Technology, Software - Application, USA, 14.44B, 38.54, 3.46, 10.84, 65.89, 31.28, 24.50%, 13.37%, 15.60%, 19.60%, 7.60%, 17.60%, 98.90%, 23.50%, 1.10, 1.10, 3.31, 4.32, 73.00%, 27.40%, 20.90%, -5.05%, 7.23%, 6.41%, 25.68%, -0.97%, 2.56%
230, FISV, Fiserv Inc., Technology, Information Technology Services, USA, 77.11B, 17.91, 4.91, 5.20, 2.42, 23.21, -18.00%, 18.06%, 18.35%, -21.20%, -0.40%, 1.20%, 2.70%, 3.10%, 1.00, 1.00, 0.65, 0.67, 49.10%, 11.40%, 5.90%, -5.77%, -1.27%, 0.19%, 7.90%, 1.18%, 1.68%
232, FKWL, Franklin Wireless Corp., Technology, Communication Equipment, USA, 100.22M, 18.11, -, 0.48, 2.49, 2.47, 547.10%, -67.88%, -, 261.60%, 185.80%, 25.50%, 61.60%, 27.90%, 2.40, 2.30, 0.00, 0.00, 17.80%, 13.50%, 10.20%, -28.25%, -52.67%, -55.14%, 68.42%, -59.15%, 5.54%
234, FLT, FLEETCOR Technologies Inc., Technology, Information Technology Services, USA, 22.86B, 18.74, 2.04, 9.78, 6.95, 21.76, -18.30%, 16.87%, 15.60%, 28.80%, -7.90%, 6.70%, 23.60%, 10.30%, 1.00, 1.00, 0.93, 1.35, -, 44.40%, 31.70%, -4.62%, -2.85%, 1.76%, 12.57%, 0.59%, 2.05%
236, FN, Fabrinet, Technology, Electronic Components, Cayman Islands, 3.28B, 17.73, 2.80, 1.85, 3.08, 42.36, -6.80%, 10.63%, 8.96%, 33.30%, 16.60%, 9.20%, 13.10%, 10.90%, 3.40, 2.50, 0.03, 0.04, 11.70%, 7.60%, 7.50%, -2.46%, -2.15%, 30.25%, 40.27%, 15.59%, 2.88%
238, FORTY, Formula Systems 1985 Ltd., Technology, Information Technology Services, Israel, 1.34B, -, -, 0.69, 2908.33, -, 20.90%, -, -, 19.10%, 22.80%, -, 10.20%, 11.90%, 46.60, 45.80, 0.00, 0.00, 23.10%, -, 2.50%, -8.35%, 2.35%, 6.47%, 27.81%, 2.05%, 2.07%
240, FROG, JFrog Ltd., Technology, Software - Application, USA, 3.73B, 426.02, -, 24.75, 6.92, -, -202.00%, 75.00%, -11.40%, -, 38.60%, -, -, -2.10%, 5.30, 5.30, 0.00, 0.00, 81.10%, -9.40%, -6.20%, -17.47%, -25.27%, -37.40%, -, -33.55%, 5.93%
221, EXFO, EXFO Inc., Technology, Communication Equipment, Canada, 210.01M, 13.60, 74.00, 0.76, 1.15, 25.61, -282.70%, 23.64%, 5.00%, 73.10%, 24.20%, 0.20%, 0.40%, -3.20%, 1.50, 1.00, 0.04, 0.13, 53.40%, 2.60%, 0.20%, -1.07%, -12.94%, 28.74%, 40.68%, 8.50%, 2.47%
223, EXTR, Extreme Networks Inc., Technology, Communication Equipment, USA, 1.44B, 15.34, -, 1.52, 40.86, 17.71, -383.00%, 34.66%, 20.00%, 107.20%, 21.00%, -3.10%, -173.20%, -25.30%, 1.00, 0.90, 9.19, 9.79, 57.50%, 0.40%, -3.10%, -4.75%, 20.29%, 98.96%, 246.67%, 66.04%, 4.72%
225, FEIM, Frequency Electronics Inc., Technology, Communication Equipment, USA, 92.53M, -, -, 1.89, 1.70, 11.71, -289.50%, -, 15.00%, 48.70%, 21.90%, -4.20%, -6.80%, -15.50%, 6.60, 3.60, 0.00, 0.00, 24.70%, -9.60%, -7.60%, -7.61%, -17.00%, -0.40%, 20.58%, -9.37%, 2.82%
227, FFIV, F5 Networks Inc., Technology, Software - Infrastructure, USA, 11.16B, 15.98, 3.50, 4.52, 5.60, 19.85, -29.20%, 13.37%, 11.80%, -30.80%, 10.60%, 6.00%, 12.70%, 11.60%, 1.00, 1.00, 0.18, 0.19, 81.50%, 14.50%, 11.30%, -2.69%, -4.48%, 12.55%, 27.95%, 5.39%, 2.01%
229, FIS, Fidelity National Information Services Inc., Technology, Information Technology Services, USA, 92.89B, 19.90, -, 7.32, 1.91, 24.96, -61.90%, 15.51%, 17.09%, -, 4.70%, -0.30%, -0.50%, 0.70%, 0.80, 0.80, 0.34, 0.40, 34.00%, 4.30%, -1.80%, -4.31%, 6.72%, 0.68%, 7.31%, 5.32%, 1.82%
231, FIVN, Five9 Inc., Technology, Software - Infrastructure, USA, 11.97B, 150.34, -, 25.05, 81.99, 314.13, -771.00%, 29.17%, 26.60%, -53.30%, 45.00%, -4.50%, -20.00%, -1.80%, 6.50, 6.50, 5.42, 5.43, 58.10%, -5.30%, -9.80%, 1.63%, -10.46%, 22.65%, 69.96%, 1.55%, 4.12%
233, FLEX, Flex Ltd., Technology, Electronic Components, Singapore, 9.02B, 9.91, 0.96, 0.37, 2.64, -, 604.80%, 8.60%, 15.70%, 388.50%, 14.20%, 4.00%, 19.00%, 10.50%, 1.50, 1.00, 1.02, 1.10, 7.40%, 3.50%, 2.50%, 1.61%, -3.89%, 9.21%, 88.16%, 1.61%, 3.35%
235, FLYW, Flywire Corporation, Technology, Information Technology Services, USA, -, -, -, -, -, -, -, -, -, -, 37.50%, -, -, -, -, -, -, -, -, -, -, -, -, -, -, -, -
237, FORM, FormFactor Inc., Technology, Semiconductors, USA, 2.69B, 20.05, 1.70, 3.74, 3.57, 25.65, 95.20%, 17.99%, 20.00%, 21.20%, 16.00%, 8.80%, 11.30%, 9.90%, 3.40, 2.70, 0.03, 0.04, 41.30%, 12.20%, 11.40%, -10.12%, -27.15%, -13.96%, 40.05%, -18.06%, 4.16%
239, FOUR, Shift4 Payments Inc., Technology, Software - Infrastructure, USA, 7.67B, 79.87, -, 9.51, 21.55, 970.92, 69.10%, 171.63%, -, -, 20.00%, -3.30%, -13.60%, -4.90%, 7.10, 7.10, 3.18, 3.18, 22.90%, -15.70%, -5.80%, -4.56%, 19.66%, 46.61%, -, 23.73%, 6.00%
242, FSLY, Fastly Inc., Technology, Software - Application, USA, 5.58B, -, -, 17.84, 5.15, -, -22.80%, 44.20%, 30.00%, -253.30%, 35.00%, -11.70%, -16.90%, -8.80%, 11.90, 11.90, 0.90, 0.91, 58.40%, -46.40%, -43.00%, -27.46%, -38.91%, -43.26%, 9.39%, -45.99%, 7.29%
244, FTFT, Future FinTech Group Inc., Technology, Software - Application, China, 227.40M, -, -, 1136.98, 2.77, -, -172.40%, -, 15.00%, 87.70%, -93.20%, -, -, -287.20%, 15.60, -, 0.00, 0.01, 77.00%, -, -, -20.41%, -45.77%, 2.67%, 167.83%, 63.83%, 10.34%
246, FTV, Fortive Corporation, Technology, Scientific & Technical Instruments, USA, 24.47B, 25.22, 1.83, 5.85, 2.73, -, 558.00%, 10.57%, 9.77%, 275.70%, -26.50%, -, -, 3.70%, 1.10, 0.90, 0.16, 0.28, 58.50%, -, -, -3.13%, 6.68%, 0.90%, 42.23%, 2.40%, 1.90%
248, GB, Global Blue Group Holding AG, Technology, Information Technology Services, Switzerland, 1.78B, -, -, 15.19, 1.23, -, 95.70%, -, -, -151.40%, -87.10%, -0.30%, -0.30%, -, 0.10, 0.10, 0.00, 0.00, -, -, -, -12.71%, -21.24%, -14.03%, -5.84%, -25.54%, 5.80%
250, GDDY, GoDaddy Inc., Technology, Software - Infrastructure, USA, 13.67B, 43.93, -, 3.99, -, 19.79, -489.40%, 49.59%, -, -74.10%, 13.80%, -8.10%, 412.50%, 8.80%, 0.80, 0.80, -, -, 64.90%, 7.20%, -15.40%, -7.90%, -4.51%, 3.73%, 4.80%, -2.40%, 2.56%
252, GDYN, Grid Dynamics Holdings Inc., Technology, Information Technology Services, USA, 839.66M, 47.29, -, 7.12, 5.65, 88.39, -138.60%, 35.42%, -, 57.50%, 20.30%, -6.30%, -6.80%, -8.50%, 7.00, 7.00, 0.00, 0.00, 40.00%, -8.70%, -8.50%, 5.27%, -2.54%, 55.72%, 92.85%, 21.98%, 4.71%
254, GILT, Gilat Satellite Networks Ltd., Technology, Communication Equipment, Israel, 568.98M, -, 1.36, 3.49, 2.48, -, -3.70%, -, 10.00%, 57.10%, -6.30%, 11.40%, 18.00%, 15.50%, 1.70, 1.40, 0.00, 0.00, 27.40%, 27.40%, 25.50%, -4.27%, -31.62%, 70.15%, 20.69%, 54.75%, 5.12%
256, GLW, Corning Incorporated, Technology, Electronic Components, USA, 36.88B, 18.19, 1.39, 3.02, 3.02, 45.81, -49.80%, 13.65%, 23.90%, 524.30%, 37.60%, 3.70%, 10.50%, 4.70%, 2.30, 1.60, 0.69, 0.71, 33.80%, 13.40%, 9.10%, -3.37%, 10.54%, 16.97%, 91.44%, 21.19%, 2.07%
258, GPRO, GoPro Inc., Technology, Consumer Electronics, USA, 1.76B, 14.08, -, 1.81, 8.07, 13.42, -343.40%, 21.49%, 10.00%, 84.50%, 70.60%, -2.00%, -7.60%, -9.60%, 2.40, 1.90, 1.05, 0.00, 36.80%, 1.60%, -1.40%, -2.18%, 37.75%, 63.80%, 138.22%, 35.51%, 6.35%
260, GSIT, GSI Technology Inc., Technology, Semiconductors, USA, 150.19M, -, -, 5.25, 1.89, -, 1.10%, -, 10.00%, -10.00%, -32.00%, -20.40%, -23.40%, -12.30%, 7.50, 6.90, 0.00, 0.00, 48.40%, -68.50%, -69.10%, 3.31%, -18.51%, 7.02%, -17.00%, -15.54%, 4.04%
241, FSLR, First Solar Inc., Technology, Solar, USA, 8.18B, 22.87, -, 2.74, 1.42, -, 442.10%, -24.77%, -9.90%, 130.10%, 51.00%, 7.30%, 9.50%, 7.30%, 4.70, 3.90, 0.04, 0.05, 26.00%, 19.10%, 17.30%, -12.81%, -10.34%, -17.67%, 63.26%, -23.06%, 4.08%
243, FTCI, FTC Solar Inc., Technology, Solar, USA, 915.25M, -, -, 4.89, -, -, -, -, -, -, -, -, -, -, -, -, -, -, -, -, -, -21.52%, -, -, -, -24.54%, 7.59%
245, FTNT, Fortinet Inc., Technology, Software - Infrastructure, USA, 35.33B, 50.27, 4.74, 12.97, 36.30, 38.00, 54.70%, 16.07%, 15.60%, 7.90%, 23.10%, 12.10%, 63.30%, 55.40%, 2.00, 1.90, 1.01, 1.01, 78.10%, 19.60%, 18.00%, 11.80%, 26.13%, 82.33%, 57.00%, 47.14%, 2.77%
247, G, Genpact Limited, Technology, Information Technology Services, Bermuda, 8.47B, 17.55, 2.27, 2.27, 4.93, 15.60, 0.80%, 13.30%, 12.50%, 6.60%, 2.50%, 6.50%, 17.90%, 10.00%, 2.00, 2.00, 0.96, 0.99, 35.30%, 12.20%, 8.40%, -5.48%, 12.22%, 11.51%, 27.23%, 10.59%, 1.71%
249, GBOX, GreenBox POS, Technology, Software - Infrastructure, USA, 445.05M, -, -, 33.97, 8.02, -, -500.60%, -, -, -111.20%, -, -62.80%, -145.10%, -319.00%, 8.80, 8.80, 0.00, 0.01, 52.80%, -, -, -5.29%, -14.61%, 88.60%, 2139.58%, 64.37%, 11.28%
251, GDS, GDS Holdings Limited, Technology, Software - Infrastructure, China, 14.13B, -, -, 14.53, 3.42, -, -29.80%, 49.10%, 0.58%, -133.60%, 37.50%, -1.90%, -4.80%, 1.30%, 2.30, 2.30, 0.86, 0.96, 25.70%, 10.60%, -15.00%, -10.23%, -27.26%, -12.65%, 31.96%, -19.67%, 5.00%
253, GIB, CGI Inc., Technology, Information Technology Services, Canada, 19.56B, 15.15, 3.07, 1.95, 4.11, 11.04, -7.60%, 8.73%, 7.60%, 14.30%, -1.70%, 7.90%, 17.10%, 9.50%, 1.10, 0.80, 0.52, 0.64, 15.60%, 13.40%, 9.90%, 0.61%, 16.42%, 22.11%, 40.21%, 12.72%, 1.42%
255, GLOB, Globant S.A., Technology, Software - Application, Luxembourg, 9.02B, 53.01, -, 10.10, 9.56, -, -4.80%, 20.88%, -, 52.30%, 41.00%, 5.20%, 7.40%, 7.20%, 2.10, 2.10, 0.09, 0.10, 37.60%, 11.80%, 7.00%, -6.81%, -6.14%, 21.89%, 55.39%, 0.12%, 3.48%
257, GNSS, Genasys Inc., Technology, Scientific & Technical Instruments, USA, 186.50M, 38.11, 1.19, 4.12, 3.45, 20.27, 317.70%, 186.00%, 15.00%, -15.80%, 36.10%, 15.90%, 21.80%, 23.80%, 3.50, 2.90, 0.00, 0.01, 50.90%, 10.80%, 23.40%, -15.77%, -23.99%, -16.79%, 19.00%, -16.41%, 5.75%
259, GRMN, Garmin Ltd., Technology, Scientific & Technical Instruments, Switzerland, 27.36B, 23.95, 4.08, 6.21, 4.77, 42.87, 3.60%, 9.31%, 6.37%, 35.70%, 25.30%, 15.70%, 19.90%, 17.10%, 3.80, 2.90, 0.00, 0.00, 59.40%, 25.60%, 23.90%, 2.57%, 10.89%, 22.23%, 57.75%, 18.87%, 1.50%
262, GTYH, GTY Technology Holdings Inc., Technology, Software - Application, USA, 349.02M, -, -, 6.97, 1.14, -, 57.10%, 33.30%, -, 2.20%, 17.70%, -10.80%, -15.00%, -12.60%, 1.00, 1.00, 0.09, 0.09, 62.70%, -79.00%, -92.30%, 18.81%, -25.47%, 44.40%, 60.00%, 15.83%, 6.78%
264, GWRE, Guidewire Software Inc., Technology, Software - Application, USA, 8.21B, 421.29, -, 10.78, 4.98, 87.55, -193.90%, -15.33%, -, 57.20%, 3.80%, -0.90%, -1.30%, -1.00%, 6.50, 6.50, 0.20, 0.20, 53.20%, -5.20%, -2.80%, -8.67%, -15.49%, -18.15%, -4.72%, -24.07%, 2.79%
266, HCKT, The Hackett Group Inc., Technology, Information Technology Services, USA, 540.00M, 14.78, 7.02, 2.31, 3.76, 16.67, -75.70%, 9.55%, 13.50%, 13.30%, -8.60%, 3.20%, 4.50%, 4.10%, 2.00, 2.00, 0.00, 0.00, 31.20%, 4.20%, 2.70%, 4.64%, 6.20%, 19.93%, 29.15%, 23.77%, 3.03%
268, HIMX, Himax Technologies Inc., Technology, Semiconductors, Taiwan, 2.15B, 8.11, -, 2.12, 4.75, 42.48, 444.50%, 3.26%, -, 3182.40%, 57.70%, 1.60%, 3.20%, 7.20%, 2.00, 1.70, 0.11, 0.34, 30.00%, 1.40%, 1.40%, -3.60%, -7.68%, 126.82%, 341.41%, 77.40%, 7.47%
270, HPE, Hewlett Packard Enterprise Company, Technology, Communication Equipment, USA, 21.26B, 8.30, -, 0.79, 1.28, 63.09, -122.10%, 4.34%, 12.51%, -33.00%, -1.70%, -0.80%, -2.70%, -1.00%, 0.90, 0.70, 0.74, 0.97, 31.50%, -2.10%, -1.60%, -2.50%, 9.32%, 41.99%, 64.37%, 34.68%, 2.29%
272, HUBS, HubSpot Inc., Technology, Software - Application, USA, 23.30B, 212.73, -, 24.14, 30.22, 236.57, -48.60%, 43.78%, 36.50%, -21.80%, 41.40%, -4.70%, -12.10%, -5.30%, 2.80, 2.80, 0.56, 0.57, 81.00%, -6.70%, -9.40%, -6.64%, -4.22%, 32.67%, 152.27%, 27.23%, 4.68%
274, IBM, International Business Machines Corporation, Technology, Information Technology Services, USA, 128.51B, 11.93, 4.37, 1.74, 6.01, 12.43, -41.70%, 10.54%, 5.61%, -27.00%, 0.90%, 3.50%, 25.60%, 6.80%, 0.90, 0.90, 2.39, 2.64, 48.60%, 7.60%, 7.30%, -0.35%, 19.05%, 15.73%, 15.08%, 14.19%, 1.45%
276, IDBA, IDEX Biometrics ASA, Technology, Software - Application, Norway, 272.82M, -, -, 249.15, -, -, -, -, -, -, 730.60%, -, -, -, -, -, -, -, -, -, -, 3.91%, -, -, -, -20.85%, 2.83%
278, IDN, Intellicheck Inc., Technology, Software - Application, USA, 143.93M, 37.50, -, 13.71, 6.25, -, 119.20%, 766.70%, 10.00%, -, -6.50%, -2.20%, -2.40%, -1.20%, 7.60, -, 0.00, 0.00, 90.90%, -12.80%, -5.00%, -20.47%, -45.26%, -26.90%, 22.15%, -34.24%, 5.90%
280, IFBD, Infobird Co. Ltd, Technology, Software - Application, China, 94.20M, -, -, 6.50, -, 67.29, -17.50%, -, -, -17.70%, -6.70%, -, -, 37.10%, 1.00, 1.00, 0.00, 0.39, 67.50%, 29.80%, 27.50%, -11.16%, -, -, -, -36.65%, 7.74%
261, GSKY, GreenSky Inc., Technology, Software - Infrastructure, USA, 1.08B, 12.96, 2.16, 2.03, -, -, -72.30%, 180.75%, 13.00%, 141.10%, 2.70%, 1.20%, -190.70%, 5.40%, -, -, -, -, 43.30%, 15.10%, 3.20%, -5.48%, 1.56%, 32.28%, 45.77%, 26.57%, 4.20%
263, GVP, GSE Systems Inc., Technology, Software - Application, USA, 36.31M, -, -, 0.69, 3.91, -, 14.40%, -, -, 65.30%, -26.00%, -15.10%, -59.80%, -42.10%, 0.70, 0.70, 0.14, 1.34, 25.60%, -10.60%, -12.20%, 21.62%, -11.33%, 63.64%, 71.43%, 36.36%, 9.09%
265, HBB, Hamilton Beach Brands Holding Company, Technology, Consumer Electronics, USA, 342.72M, 11.72, -, 0.54, 4.22, -, 59.20%, 2.38%, -, 308.60%, 23.50%, 8.20%, 38.80%, 15.50%, 2.10, 0.90, 1.24, 1.24, 23.00%, 6.70%, 4.40%, 26.82%, 41.10%, 26.76%, 163.87%, 43.92%, 4.61%
267, HEAR, Turtle Beach Corporation, Technology, Consumer Electronics, USA, 516.03M, 18.98, 0.70, 1.23, 4.05, 10.86, 107.20%, 16.42%, 16.00%, 299.40%, 166.00%, 27.20%, 50.00%, 31.90%, 2.40, 1.50, 0.00, 0.00, 37.80%, 16.30%, 12.20%, 11.26%, 3.28%, 79.89%, 212.85%, 53.60%, 6.24%
269, HLIT, Harmonic Inc., Technology, Communication Equipment, USA, 706.62M, 17.08, -, 1.72, 2.64, -, -356.40%, 114.74%, 19.40%, 125.00%, 7.60%, -6.50%, -15.50%, -4.10%, 1.60, 1.40, 0.54, 0.59, 52.10%, -5.70%, -9.00%, -15.00%, -15.16%, 3.41%, 29.31%, -5.68%, 3.97%
271, HPQ, HP Inc., Technology, Computer Hardware, USA, 40.02B, 8.17, 0.61, 0.66, -, 14.61, -0.70%, 2.61%, 17.03%, 77.90%, 7.00%, 8.30%, -138.90%, 76.10%, 0.70, 0.50, -, -, 19.40%, 5.60%, 4.70%, -15.76%, -1.18%, 31.37%, 93.06%, 18.87%, 2.60%
273, IBEX, IBEX Limited, Technology, Software - Application, USA, 387.41M, 15.51, -, 0.89, 5.18, 16.63, 271.90%, 25.18%, -, -102.10%, -64.20%, -2.00%, -8.30%, 14.10%, 1.40, 1.40, 1.01, 1.46, -, 1.60%, -1.10%, -5.44%, -3.33%, 8.65%, -, 16.26%, 6.33%
275, ICHR, Ichor Holdings Ltd., Technology, Semiconductor Equipment & Materials, USA, 1.55B, 13.67, 1.89, 1.62, 3.66, 21.60, 201.00%, 16.37%, 16.76%, 247.80%, 20.30%, 6.50%, 13.30%, 7.00%, 2.70, 2.00, 0.37, 0.39, 15.20%, 5.70%, 4.60%, -2.73%, 20.45%, 77.20%, 147.30%, 86.63%, 5.09%
277, IDEX, Ideanomics Inc., Technology, Software - Application, USA, 1.28B, -, -, 21.62, 2.72, -, 44.00%, -40.00%, -, 98.10%, 17753.20%, -31.80%, -46.90%, -42.70%, 3.20, 3.20, 0.00, 0.20, 21.80%, -, -, -7.10%, -20.66%, 6.27%, 631.34%, 44.72%, 8.47%
279, IEC, IEC Electronics Corp., Technology, Electronic Components, USA, 119.95M, 12.58, -, 0.64, 2.92, -, 39.90%, 21.92%, -, -123.10%, 2.70%, 3.80%, 13.30%, 12.10%, 1.90, 0.90, 1.49, 1.53, 12.00%, 4.30%, 2.80%, -8.65%, -12.98%, 12.11%, 40.70%, -17.34%, 3.48%
282, IIIV, i3 Verticals Inc., Technology, Software - Infrastructure, USA, 991.13M, 24.54, -, 6.16, 3.26, 27.69, 90.30%, 22.08%, -, -71.20%, 22.20%, -0.70%, -2.00%, 4.30%, 0.50, 0.50, 0.89, 0.89, 70.60%, -0.50%, -1.90%, -7.97%, -8.91%, 12.98%, 7.66%, -6.42%, 4.03%
284, IMMR, Immersion Corporation, Technology, Software - Application, USA, 268.98M, 10.18, 1.31, 8.57, 2.32, 48.03, 129.80%, 26.32%, 15.00%, 144.80%, 14.30%, 12.10%, 18.00%, 7.00%, 12.60, 12.60, 0.00, 0.00, 99.50%, 29.70%, 39.10%, -3.72%, -19.11%, -1.38%, 26.57%, -24.27%, 5.38%
286, IMXI, International Money Express Inc., Technology, Information Technology Services, USA, 596.90M, 12.49, 28.89, 1.59, 5.53, -, 68.90%, 16.70%, 0.55%, 54.50%, 22.40%, 14.20%, 41.90%, 22.20%, 2.50, 2.50, 0.88, 0.96, -, 15.20%, 9.90%, -4.62%, 0.13%, -4.68%, 38.44%, -1.61%, 3.89%
288, INFY, Infosys Limited, Technology, Information Technology Services, India, 81.87B, 25.12, 3.86, 5.92, 7.80, 46.11, 17.00%, 11.59%, 8.00%, 17.30%, 13.10%, 19.00%, 27.20%, 21.30%, 2.50, 2.50, 0.06, 0.07, 34.90%, 24.50%, 19.30%, 4.77%, 9.51%, 28.08%, 112.53%, 14.10%, 1.13%
290, INPX, Inpixon, Technology, Software - Application, USA, 116.20M, -, -, 12.49, 1.26, -, 97.90%, -, 20.00%, -, 66.70%, -, -, -47.50%, 8.70, 8.60, 0.00, 0.04, 71.90%, -, -, -6.19%, -23.74%, -10.17%, -19.08%, 3.92%, 4.70%
292, INSG, Inseego Corp., Technology, Communication Equipment, USA, 891.48M, -, -, 2.83, -, 62.78, -129.70%, 74.10%, 20.00%, 13.00%, 1.40%, -49.70%, 462.40%, -74.50%, 1.90, 1.50, -, -, 29.30%, -32.60%, -36.10%, -6.42%, -42.78%, -8.12%, -19.02%, -44.41%, 5.78%
294, INTT, inTEST Corporation, Technology, Semiconductors, USA, 149.95M, 14.67, 4.01, 2.41, 3.04, 74.98, -139.10%, 7.87%, 15.00%, 287.90%, 75.00%, 3.90%, 5.40%, -2.00%, 2.90, 2.20, 0.00, 0.00, 46.30%, 4.50%, 4.00%, 9.74%, 61.28%, 185.02%, 342.77%, 116.95%, 5.03%
296, INTZ, Intrusion Inc., Technology, Software - Application, USA, 246.53M, 18.57, -, 36.80, 21.54, -, -259.50%, 270.20%, -, -512.30%, 5.60%, -84.30%, -134.40%, -40.00%, 5.50, 5.50, 0.02, 0.05, 61.20%, -, -, -16.00%, -34.28%, 12.49%, 216.17%, -15.66%, 15.38%
298, IPGP, IPG Photonics Corporation, Technology, Semiconductor Equipment & Materials, USA, 11.06B, 31.84, 1.40, 8.52, 4.24, 50.54, -11.40%, 19.84%, 42.00%, 85.30%, 38.70%, 6.70%, 7.50%, 5.80%, 10.30, 8.50, 0.01, 0.01, 46.30%, 18.70%, 14.70%, -9.67%, -8.53%, 3.47%, 34.66%, -6.49%, 3.95%
300, ISDR, Issuer Direct Corporation, Technology, Information Technology Services, USA, 96.53M, 24.65, -, 4.95, 3.42, -, 213.20%, 12.90%, -, 141.60%, 25.00%, 7.00%, 8.80%, 7.30%, 4.40, 4.40, 0.00, 0.00, 71.50%, 16.60%, 12.40%, -6.13%, 13.15%, 28.76%, 147.66%, 47.80%, 7.11%
281, III, Information Services Group Inc., Technology, Information Technology Services, USA, 290.01M, 18.60, 4.98, 1.15, 2.82, 5.80, -21.40%, 1.61%, 8.00%, 327.70%, 4.60%, 3.30%, 7.90%, 3.50%, 2.20, 2.20, 0.72, 0.76, 40.50%, 6.00%, 3.00%, 30.22%, 56.27%, 100.00%, 240.70%, 78.66%, 5.35%
283, IIVI, II-VI Incorporated, Technology, Scientific & Technical Instruments, USA, 7.19B, 17.17, 1.33, 2.36, 2.45, 14.90, -148.40%, 8.28%, 22.19%, 905.10%, 24.90%, 4.30%, 9.50%, 0.40%, 4.30, 3.30, 0.46, 0.48, 39.80%, 11.10%, 8.10%, -6.34%, -22.39%, 0.70%, 41.74%, -11.31%, 4.33%
285, IMOS, ChipMOS TECHNOLOGIES INC., Technology, Semiconductors, Taiwan, 1.16B, -, 1.39, 1.40, 0.06, 9.71, -8.40%, -, 10.00%, 29.50%, 15.70%, -, -, 10.10%, 2.40, 2.00, 0.39, 0.42, 21.90%, -, -, -6.77%, 18.40%, 49.12%, 58.35%, 32.40%, 2.22%
287, INFN, Infinera Corporation, Technology, Communication Equipment, USA, 1.95B, 27.12, -, 1.44, 4.95, -, 49.20%, 5800.00%, 5.00%, 56.30%, 0.20%, -9.60%, -41.60%, -16.50%, 1.80, 1.30, 1.16, 1.22, 33.40%, -7.50%, -11.50%, 0.95%, -1.64%, 14.01%, 92.77%, -8.40%, 4.26%
289, INOD, Innodata Inc., Technology, Information Technology Services, USA, 169.02M, -, 7.28, 2.83, 5.35, -, 129.00%, -, 20.00%, 213.20%, 10.30%, -, -, 1.70%, 1.80, 1.80, 0.19, 0.26, 35.10%, -, -, -3.84%, -0.63%, 59.69%, 360.29%, 18.11%, 6.01%
291, INS, Intelligent Systems Corporation, Technology, Software - Application, USA, 299.91M, 21.21, -, 8.13, 6.82, 58.81, -26.00%, 24.19%, -, 0.30%, 12.70%, 14.90%, 19.10%, 17.60%, 5.00, 5.00, 0.00, 0.00, 57.50%, 27.80%, 22.10%, -17.25%, -21.26%, -15.43%, 2.00%, -18.55%, 4.29%
