Index, Symbol, Company Name, Sector, Industry, Country, Market Cap, Forward PE, PEG, Price/Sales, Price/Book, Price/FCF, EPS This Y, EPS Next Y, EPS Next 5Y, EPS Q/Q, Sales Q/Q, ROA, ROE, ROI, Current Ratio, Quick Ratio, LT Debt/Equity, Debt/Equity, Gross Margin, Operating Margin, Net Margin, Perf Month, Perf Quarter, Perf Half Y, Perf Year, Perf YTD, Volatility (Month)
2, AAPL, Apple Inc., Technology, Consumer Electronics, USA, 2090.63B, 23.29, 1.56, 6.42, 30.17, 27.42, 10.20%, 3.02%, 17.93%, 118.60%, 53.60%, 22.90%, 111.80%, 31.70%, 1.10, 1.10, 1.57, 1.76, 39.90%, 27.30%, 23.50%, -6.65%, -2.49%, 7.39%, 56.77%, -6.09%, 1.86%
4, ACIW, ACI Worldwide Inc., Technology, Software - Infrastructure, USA, 4.60B, 29.98, 3.98, 3.57, 3.75, 13.92, 8.80%, 10.96%, 12.00%, 92.10%, -2.20%, 3.00%, 8.20%, 5.00%, 1.30, 1.30, 0.92, 0.94, 52.20%, 13.10%, 7.40%, -3.02%, -2.79%, 15.33%, 38.72%, -0.44%, 2.97%
6, ACMR, ACM Research Inc., Technology, Semiconductor Equipment & Materials, USA, 1.46B, 34.43, 3.61, 8.32, 9.98, 610.06, -10.20%, 57.31%, 20.00%, 110.90%, 85.40%, 5.10%, 12.40%, 12.80%, 2.50, 1.70, 0.13, 0.32, 44.00%, 11.30%, 8.10%, -5.02%, -29.45%, -1.39%, 27.08%, -6.49%, 6.01%
8, ACVA, ACV Auctions Inc., Technology, Software - Application, USA, 4.02B, -, -, 17.10, 6.70, -, 46.90%, 15.60%, 0.80%, 37.00%, 63.70%, -, -, 30.50%, 2.80, 2.80, 0.01, 0.01, 47.70%, -12.70%, -13.10%, -25.41%, -, -, -, -17.06%, 7.07%
10, ADI, Analog Devices Inc., Technology, Semiconductors, USA, 60.20B, 23.65, 3.00, 9.71, 4.99, 47.22, -10.00%, 10.85%, 13.08%, 57.50%, 26.10%, 7.30%, 13.00%, 8.20%, 1.00, 0.80, 0.31, 0.42, 67.40%, 30.10%, 25.20%, 4.17%, 3.79%, 21.07%, 45.73%, 11.42%, 2.46%
12, ADTN, ADTRAN Inc., Technology, Communication Equipment, USA, 971.88M, 30.81, 31.78, 1.87, 2.59, -, 104.40%, 23.65%, 2.30%, 108.80%, 11.40%, 2.50%, 3.60%, -0.30%, 3.20, 2.00, 0.00, 0.00, 42.30%, -1.20%, 2.50%, 12.30%, 11.79%, 58.48%, 73.77%, 34.12%, 4.43%
14, AEY, ADDvantage Technologies Group Inc., Technology, Electronics & Computer Distribution, USA, 31.19M, -, -, 0.63, 2.80, -, -298.70%, -, -, 82.50%, 5.80%, -18.80%, -42.30%, -75.50%, 1.50, 1.10, 0.17, 0.61, 30.90%, -14.30%, -12.00%, 27.09%, -16.23%, -7.53%, 40.22%, -13.71%, 6.35%
16, AFRM, Affirm Holdings Inc., Technology, Information Technology Services, USA, 15.19B, -, -, 21.60, 5.90, -, 6.50%, 54.90%, -0.71%, -200.30%, 66.90%, -, -, -20.60%, -, -, 0.83, 0.83, -, -39.00%, -41.70%, -17.85%, -33.50%, -, -, -37.46%, 8.58%
18, AGYS, Agilysys Inc., Technology, Software - Application, USA, 1.25B, 55.21, -, 9.10, 14.98, 46.22, 31.40%, 30.50%, 0.05%, 9.60%, -8.60%, -13.00%, -30.40%, -26.00%, 2.20, 2.20, 0.00, 0.00, 65.20%, -15.30%, -17.20%, -1.03%, -19.27%, 32.06%, 164.12%, 32.33%, 4.65%
20, AIRG, Airgain Inc., Technology, Communication Equipment, USA, 207.43M, 27.84, -, 3.79, 3.88, -, -468.10%, 157.40%, 35.00%, 117.60%, 55.40%, -3.20%, -3.80%, -7.20%, 3.80, 3.50, 0.00, 0.00, 44.20%, -7.00%, -3.40%, -7.59%, -17.94%, 48.58%, 119.82%, 11.64%, 5.83%
1, AAOI, Applied Optoelectronics Inc., Technology, Semiconductors, USA, 220.48M, -, -, 0.90, 0.78, -, 19.10%, 65.50%, 13.00%, 28.90%, 22.70%, -11.90%, -21.20%, -13.20%, 2.10, 1.10, 0.33, 0.54, 22.50%, -18.50%, -23.50%, 4.05%, -8.76%, -2.37%, -6.80%, -3.29%, 5.77%
3, ABST, Absolute Software Corporation, Technology, Software - Application, Canada, 682.72M, -, -, 6.12, -, -, -, -, -, -29.80%, 15.70%, -, -, -, -, -, -, -, -, -, -, -10.09%, -10.90%, 36.95%, 61.07%, 16.71%, 3.50%
5, ACLS, Axcelis Technologies Inc., Technology, Semiconductor Equipment & Materials, USA, 1.38B, 16.09, 1.29, 2.82, 2.87, 36.61, 190.80%, 32.31%, 20.00%, 44.40%, 11.60%, 9.10%, 11.80%, 9.80%, 5.70, 3.60, 0.10, 0.10, 42.90%, 13.30%, 11.30%, -3.47%, 4.36%, 53.94%, 54.34%, 42.31%, 4.42%
7, ACN, Accenture plc, Technology, Information Technology Services, Ireland, 186.27B, 30.06, 3.42, 4.08, 9.80, 25.25, 7.30%, 10.80%, 9.75%, 15.10%, 8.50%, 14.50%, 31.50%, 28.90%, 1.40, 1.40, 0.00, 0.00, 31.70%, 14.90%, 11.90%, -3.55%, 9.30%, 13.17%, 39.95%, 8.02%, 1.36%
9, ADBE, Adobe Inc., Technology, Software - Infrastructure, USA, 238.18B, 36.88, 2.50, 17.41, 17.84, 41.14, 80.50%, 15.38%, 17.50%, 33.40%, 26.30%, 23.90%, 45.10%, 30.60%, 1.30, 1.30, 0.30, 0.00, 87.50%, 34.70%, 40.70%, -2.23%, 7.46%, 7.34%, 30.52%, 0.89%, 2.08%
11, ADSK, Autodesk Inc., Technology, Software - Application, USA, 63.09B, 41.66, 1.38, 16.20, 64.97, 45.18, 440.10%, 39.41%, 35.58%, 549.10%, 15.60%, 7.00%, 178.10%, 49.60%, 0.80, 0.80, 1.70, 1.70, 91.10%, 14.90%, 11.00%, -3.52%, 0.56%, 5.39%, 35.88%, -6.38%, 2.61%
13, AEHR, Aehr Test Systems, Technology, Semiconductor Equipment & Materials, USA, 49.99M, -, -, 3.94, 5.00, -, 47.60%, 62.50%, 20.00%, -395.00%, -13.10%, -29.10%, -46.00%, -17.70%, 2.40, 1.20, 0.02, 0.30, 18.90%, -42.20%, -43.00%, -2.60%, -27.18%, 34.73%, 36.36%, -11.07%, 9.19%
15, AEYE, AudioEye Inc., Technology, Software - Application, USA, 193.30M, 118.32, -, 8.79, 8.34, -, 19.90%, 140.50%, -, -40.50%, 34.90%, -41.60%, -86.60%, -79.30%, 3.10, 3.10, 0.04, 0.06, 72.80%, -37.50%, -37.80%, -28.16%, -45.61%, 17.87%, 116.53%, -29.00%, 9.41%
17, AGMH, AGM Group Holdings Inc., Technology, Software - Application, Hong Kong, 255.23M, -, -, 4788.18, 68.06, -, 27.80%, -, -, 40.90%, -98.00%, -10.20%, -13.40%, -, 2.50, 2.50, 0.00, 0.00, -, -, -, -8.61%, -27.26%, -22.97%, -45.66%, -24.28%, 3.52%
19, AI, C3.ai Inc., Technology, Information Technology Services, USA, 6.38B, -, -, 36.96, 5.80, -, -108.10%, -85.70%, -13.02%, -64.20%, 18.90%, -, -, 38.80%, 11.20, 11.20, 0.00, 0.00, 75.50%, -38.60%, -36.00%, -7.48%, -49.02%, -, -, -55.52%, 7.19%
22, AKTS, Akoustis Technologies Inc., Technology, Communication Equipment, USA, 478.62M, -, -, 99.71, 3.71, -, -0.90%, 30.70%, -, -4.00%, 525.00%, -52.10%, -73.30%, -49.50%, 14.00, 13.80, 0.00, 0.01, -71.90%, -, -, -21.41%, -38.35%, 24.90%, 29.63%, -21.67%, 5.98%
24, ALGM, Allegro MicroSystems Inc., Technology, Semiconductors, USA, 5.06B, 31.77, 20.15, 8.57, 8.62, -, -56.40%, 26.53%, 13.69%, -260.00%, 7.90%, -, -, 5.10%, 4.20, 3.20, 0.04, 0.04, 47.20%, -, -, 3.47%, -3.53%, 9.21%, -, -1.69%, 4.84%
26, ALLT, Allot Ltd., Technology, Communication Equipment, Israel, 682.13M, -, -, 4.95, 5.36, -, -5.60%, 47.60%, -, -132.30%, 6.50%, -5.70%, -9.00%, -8.60%, 2.60, 2.40, 0.00, 0.00, 69.50%, -8.10%, -8.50%, 4.16%, 21.18%, 94.35%, 80.69%, 83.27%, 4.59%
28, ALRM, Alarm.com Holdings Inc., Technology, Software - Application, USA, 4.03B, 42.71, 2.50, 6.31, 7.40, 42.92, 43.50%, 13.84%, 20.00%, 63.50%, 13.60%, 10.50%, 18.20%, 9.30%, 8.70, 8.20, 0.75, 0.75, 63.20%, 9.60%, 13.10%, -11.38%, -12.87%, 12.10%, 73.14%, -20.85%, 3.68%
30, ALYA, Alithya Group Inc., Technology, Information Technology Services, Canada, 158.61M, -, -, 0.56, 1.10, -, -, -, 15.00%, -, 6.60%, -, -, -, -, -, -, -, -, -, -, -11.49%, -7.96%, -11.86%, 30.00%, -0.48%, 4.79%
32, AMBA, Ambarella Inc., Technology, Semiconductor Equipment & Materials, USA, 3.70B, 93.81, -, 16.58, 7.47, 128.37, -27.30%, 53.52%, 10.06%, 8.30%, 8.60%, -10.90%, -12.90%, -13.40%, 6.70, 6.40, 0.00, 0.00, 60.80%, -27.50%, -26.80%, -2.43%, -15.51%, 32.17%, 76.91%, 9.32%, 4.32%
34, AMKR, Amkor Technology Inc., Technology, Semiconductors, USA, 5.14B, 11.23, 0.28, 0.98, 2.11, 23.03, 177.30%, -3.24%, 47.05%, 84.60%, 15.10%, 7.80%, 17.40%, 11.70%, 1.60, 1.40, 0.39, 0.45, 19.00%, 9.90%, 7.50%, 0.62%, -14.61%, 48.02%, 99.43%, 39.92%, 3.59%
36, AMPG, AmpliTech Group Inc., Technology, Communication Equipment, USA, 40.68M, -, -, 11.62, 2.48, -, -, -, -, -, -37.50%, -, -, -41.60%, 13.60, 12.70, 0.14, 0.16, 36.30%, -, -, -26.18%, -48.11%, 51.33%, 482.05%, 23.77%, 8.56%
38, AMSWA, American Software Inc., Technology, Software - Application, USA, 659.33M, 75.92, 7.44, 5.88, 5.45, 54.49, -3.90%, -1.85%, 16.00%, -30.90%, -9.50%, 3.30%, 4.70%, 5.00%, 2.90, 2.90, 0.00, 0.00, 53.70%, 3.70%, 5.00%, -4.19%, -0.10%, 25.99%, 3.44%, 17.18%, 2.62%
40, ANSS, ANSYS Inc., Technology, Software - Application, USA, 29.35B, 42.95, 5.98, 16.87, 7.13, 54.60, -5.00%, 13.13%, 10.74%, 56.10%, 19.10%, 8.70%, 12.10%, 8.90%, 2.70, 2.70, 0.19, 0.19, 86.40%, 29.50%, 26.50%, -9.11%, -2.36%, 4.67%, 19.41%, -7.11%, 2.50%
21, AKAM, Akamai Technologies Inc., Technology, Software - Infrastructure, USA, 18.69B, 18.85, 2.67, 5.71, 4.31, 16.19, 16.10%, 9.67%, 12.00%, 24.90%, 10.30%, 7.80%, 14.20%, 9.90%, 3.00, 3.00, 0.45, 0.45, 64.30%, 21.00%, 18.00%, 3.83%, 19.04%, 10.09%, 7.95%, 8.78%, 1.88%
23, ALF, Alfi Inc., Technology, Software - Infrastructure, USA, 35.91M, -, -, -, -, -, -, -, -, -, -, -, -, -, 0.30, -, -, -, -, -, -, -, -, -, -, -2.41%, -
25, ALKT, Alkami Technology Inc., Technology, Software - Application, USA, 2.88B, -, -, 25.66, -, -, -31.50%, -, -, -, -, -, -, 14.70%, 6.60, 6.60, -, -, -, -, -, -30.21%, -, -, -, -22.63%, 7.10%
27, ALOT, AstroNova Inc., Technology, Computer Hardware, USA, 117.16M, -, -, 1.01, 1.55, 9.45, -26.30%, -, -, 160.40%, -3.60%, 1.10%, 1.80%, 1.70%, 2.90, 1.50, 0.15, 0.22, 35.60%, 2.10%, 1.10%, 4.70%, 43.81%, 65.48%, 152.72%, 52.58%, 3.76%
29, ALTR, Altair Engineering Inc., Technology, Software - Infrastructure, USA, 5.07B, 104.13, -, 10.37, 12.57, 149.49, -36.00%, 25.15%, -, 131.30%, 14.20%, -0.30%, -0.60%, -0.10%, 1.10, 1.10, 0.00, 0.48, 75.60%, 3.70%, -0.40%, 0.18%, 6.48%, 30.13%, 72.35%, 15.80%, 3.56%
31, AMAT, Applied Materials Inc., Technology, Semiconductor Equipment & Materials, USA, 126.47B, 18.75, 1.16, 6.38, 10.58, 37.08, 38.20%, 11.81%, 24.88%, 75.40%, 41.10%, 19.50%, 40.60%, 23.80%, 3.10, 2.30, 0.45, 0.00, 45.80%, 26.50%, 22.40%, 2.02%, 12.99%, 70.24%, 145.87%, 60.06%, 3.51%
33, AMD, Advanced Micro Devices Inc., Technology, Semiconductors, USA, 95.28B, 30.00, 1.20, 8.34, 15.00, 55.11, 604.70%, 23.79%, 28.25%, 232.40%, 92.90%, 35.40%, 59.20%, 40.90%, 2.50, 1.90, 0.05, 0.00, 44.80%, 15.60%, 25.20%, -4.56%, -7.30%, -7.65%, 48.85%, -12.68%, 2.89%
35, AMOT, Allied Motion Technologies Inc., Technology, Electronic Components, USA, 524.63M, 23.76, 0.79, 1.40, 3.31, 24.52, -20.60%, 29.57%, 30.00%, 192.20%, 10.10%, 6.20%, 15.50%, 6.80%, 2.70, 1.60, 0.78, 0.78, 29.40%, 6.10%, 5.70%, -1.17%, 5.50%, 25.12%, 46.73%, 3.91%, 4.40%
37, AMST, Amesite Inc., Technology, Software - Application, USA, 48.80M, -, -, 122.01, 3.73, -, -5.90%, 56.60%, -, 17.20%, 100.00%, -81.60%, -92.30%, -, 12.30, 12.30, 0.00, 0.00, -, -, -, -7.36%, -60.43%, -48.04%, -, -50.72%, 10.43%
39, ANET, Arista Networks Inc., Technology, Computer Hardware, USA, 25.73B, 29.64, 4.11, 10.45, 7.50, 33.09, -24.90%, 11.62%, 9.70%, 30.80%, 27.60%, 14.70%, 21.00%, 17.90%, 5.10, 4.40, 0.00, 0.00, 63.70%, 30.70%, 27.50%, 5.23%, 17.86%, 25.44%, 45.37%, 16.80%, 2.35%
42, AOSL, Alpha and Omega Semiconductor Limited, Technology, Semiconductors, USA, 845.83M, 10.62, 1.34, 1.41, 2.41, 8.06, -452.40%, 10.77%, 17.00%, 322.60%, 58.30%, 4.60%, 12.00%, -3.10%, 1.80, 1.10, 0.31, 0.48, 28.70%, 6.70%, 6.40%, 0.41%, -14.90%, 29.77%, 206.18%, 36.25%, 6.06%
44, API, Agora Inc., Technology, Software - Application, China, 4.86B, 532.02, -, 35.13, 2.80, -, -256.20%, 1600.00%, 26.70%, -, 74.30%, -, -, -0.90%, 18.50, 18.50, 0.00, 0.00, 61.70%, -, -, -12.06%, -32.22%, 16.96%, -, 12.97%, 7.54%
46, APPF, AppFolio Inc., Technology, Software - Application, USA, 4.59B, 236.65, 1.23, 14.52, 16.23, 159.53, 334.80%, 129.84%, 25.00%, -75.90%, 8.80%, 42.60%, 62.70%, -10.00%, 4.20, 4.20, 0.00, 0.00, 61.00%, 0.40%, 49.60%, -8.19%, -16.72%, -9.71%, -14.90%, -25.08%, 4.65%
48, APPS, Digital Turbine Inc., Technology, Software - Application, USA, 5.94B, 62.54, 3.17, 23.02, 52.52, 114.58, 387.00%, 53.33%, 50.00%, 324.50%, 146.10%, 18.90%, 41.40%, 24.30%, 1.10, 1.10, 0.15, 0.17, 42.20%, 17.90%, 15.00%, -8.58%, -30.16%, 69.84%, 930.69%, 16.99%, 7.13%
50, ARW, Arrow Electronics Inc., Technology, Electronics & Computer Distribution, USA, 8.99B, 9.27, 0.62, 0.29, 1.75, 11.64, 406.20%, 7.54%, 20.10%, 346.00%, 31.40%, 4.60%, 15.00%, 9.80%, 1.50, 1.10, 0.37, 0.44, 11.10%, 3.40%, 2.40%, 2.37%, 15.95%, 29.75%, 74.19%, 23.67%, 2.47%
52, ASML, ASML Holding N.V., Technology, Semiconductor Equipment & Materials, Netherlands, 278.19B, 38.52, 1.73, 14.35, 16.88, 79.50, 37.90%, 17.46%, 29.80%, 244.10%, 78.80%, 17.20%, 33.30%, 18.90%, 2.30, 1.60, 0.34, 0.00, 50.60%, 32.60%, 28.30%, 1.96%, 15.75%, 59.50%, 104.99%, 38.50%, 2.53%
54, ASX, ASE Technology Holding Co. Ltd., Technology, Semiconductors, Taiwan, 17.19B, 11.22, 0.44, 0.96, 2.09, 6.20, 62.80%, 9.16%, 34.20%, 115.80%, 22.70%, 5.50%, 15.10%, 6.80%, 1.40, 1.00, 0.75, 0.95, 16.80%, 8.00%, 6.50%, -6.53%, 4.02%, 56.34%, 96.57%, 37.33%, 2.27%
56, ATC, Atotech Limited, Technology, Electronic Components, United Kingdom, 4.66B, 34.66, -, 3.78, -, -, -278.40%, 103.51%, -, -107.40%, 19.40%, -, -, -6.50%, 1.70, 1.40, 5.46, 5.51, 54.80%, -8.60%, -36.20%, 8.89%, 14.10%, -, -, 25.30%, 4.57%
58, ATER, Aterian Inc., Technology, Consumer Electronics, USA, 580.32M, -, -, 2.79, 12.21, 39.75, -10.70%, -, -, -218.20%, 87.90%, -91.10%, -520.00%, -33.50%, 1.10, 0.60, 2.17, 3.38, 48.30%, -24.30%, -62.70%, -24.26%, -59.16%, 141.91%, 248.54%, 4.30%, 13.07%
60, AUDC, AudioCodes Ltd., Technology, Communication Equipment, Israel, 1.05B, 19.19, 3.07, 4.63, 5.17, 31.43, 541.10%, 10.07%, 11.10%, 72.90%, 13.10%, 9.20%, 15.90%, 13.70%, 2.00, 1.70, 0.00, 0.00, 68.50%, 18.60%, 14.10%, 6.50%, 10.32%, 15.94%, -11.90%, 17.21%, 2.93%
41, ANY, Sphere 3D Corp., Technology, Software - Application, Canada, 18.60M, -, -, 3.88, -, -, 38.20%, -, 20.00%, 2.60%, -10.00%, -60.60%, 113.50%, 138.80%, 0.30, 0.20, -, -, 46.40%, -, -, -25.73%, -43.75%, -11.56%, -32.89%, 6.99%, 8.55%
43, APH, Amphenol Corporation, Technology, Electronic Components, USA, 40.15B, 26.61, 2.69, 4.41, 7.38, 43.44, 4.30%, 11.12%, 12.00%, 33.70%, 27.70%, 10.70%, 25.00%, 14.30%, 2.40, 1.80, 0.75, 0.85, 31.10%, 19.60%, 14.20%, -2.01%, 3.51%, 2.82%, 39.31%, 2.87%, 1.75%
45, APP, AppLovin Corporation, Technology, Software - Application, USA, 25.41B, 98.55, -, 14.16, -, -, -263.90%, 131.29%, -, -, 132.10%, -, -, -4.90%, 2.40, 2.40, -, -, 60.90%, -, -, 25.59%, -, -, -, 13.97%, 6.80%
47, APPN, Appian Corporation, Technology, Software - Infrastructure, USA, 6.26B, -, -, 19.90, 21.65, -, 37.40%, 22.20%, -, -11.20%, 12.70%, -7.20%, -11.90%, -13.10%, 2.50, 2.50, 0.00, 0.00, 72.00%, -12.60%, -11.30%, -28.76%, -51.61%, -48.27%, 58.85%, -44.18%, 7.90%
49, ARRY, Array Technologies Inc., Technology, Solar, USA, 2.04B, 20.22, 11.18, 2.34, -, -, 38.00%, 86.14%, 3.00%, -92.80%, -62.00%, -, -, 20.10%, 1.20, 0.70, -, -, -, -, -, -44.63%, -59.15%, -65.63%, -, -62.22%, 7.88%
51, ASAN, Asana Inc., Technology, Software - Application, USA, 6.02B, -, -, 26.53, -, -, -70.90%, 8.70%, -, -133.30%, 57.20%, -34.10%, 254.80%, -47.90%, 2.70, 2.70, -, -, 87.30%, -77.30%, -93.30%, 9.99%, -0.51%, 42.45%, -, 24.47%, 6.27%
53, ASUR, Asure Software Inc., Technology, Software - Application, USA, 158.69M, 41.63, -, 2.39, 1.11, -, 62.40%, 128.09%, 25.00%, 25.20%, 4.80%, -4.00%, -11.60%, -8.30%, 1.00, 1.00, 0.07, 0.16, 59.50%, -19.00%, -24.30%, 4.45%, 4.19%, 8.19%, 36.73%, 19.01%, 3.89%
55, ASYS, Amtech Systems Inc., Technology, Semiconductor Equipment & Materials, USA, 145.64M, 12.73, -, 2.14, 1.77, -, -225.30%, 645.45%, 20.00%, 54.70%, 36.60%, -1.60%, -2.00%, -4.70%, 7.30, 5.70, 0.06, 0.06, 38.40%, 0.10%, -2.40%, -4.57%, 2.76%, 78.16%, 99.24%, 63.64%, 6.21%
57, ATEN, A10 Networks Inc., Technology, Software - Infrastructure, USA, 761.76M, 15.69, 1.63, 3.36, 5.97, 18.18, 195.10%, 18.32%, 23.00%, 977.90%, 1.90%, 7.30%, 17.60%, 14.10%, 2.50, 2.30, 0.00, 0.00, 77.70%, 9.70%, 9.20%, 9.94%, 0.93%, 19.68%, 43.09%, -1.32%, 2.75%
59, ATOM, Atomera Incorporated, Technology, Semiconductor Equipment & Materials, USA, 430.68M, -, -, 1076.69, 10.45, -, 5.40%, 6.90%, -, 24.60%, 300.00%, -47.80%, -50.80%, -, 31.70, 31.70, 0.00, 0.00, -, -, -, 5.22%, -35.78%, 98.75%, 102.19%, 9.07%, 8.79%
62, AVGO, Broadcom Inc., Technology, Semiconductors, USA, 190.95B, 16.28, 6.36, 7.74, 8.02, 28.59, -2.10%, 7.86%, 8.60%, 318.20%, 13.60%, 4.70%, 15.30%, 7.20%, 2.10, 2.00, 1.71, 1.75, 57.70%, 20.80%, 14.80%, 1.30%, -3.52%, 20.85%, 62.16%, 7.87%, 2.35%
64, AVNW, Aviat Networks Inc., Technology, Communication Equipment, USA, 408.41M, 14.00, 0.33, 1.54, 2.29, 29.17, -97.30%, 14.04%, 12.00%, -, 8.10%, 51.60%, 106.10%, -0.10%, 1.80, 1.50, 0.00, 0.00, 37.10%, 7.80%, 40.80%, 11.19%, 8.71%, 111.44%, 385.04%, 116.46%, 7.53%
66, AVYA, Avaya Holdings Corp., Technology, Software - Application, USA, 2.47B, 8.46, -, 0.84, 8.19, 68.74, -24.10%, 7.27%, 11.00%, 90.30%, 8.20%, -0.40%, -10.00%, -16.60%, 1.30, 1.30, 9.50, 9.51, 55.60%, 7.90%, -0.80%, -3.60%, -8.31%, 52.15%, 96.44%, 49.77%, 4.67%
68, AXTI, AXT Inc., Technology, Semiconductor Equipment & Materials, USA, 439.88M, 26.44, 6.28, 4.15, 2.18, -, 212.20%, 28.76%, 10.00%, -, 51.70%, 2.60%, 3.60%, 2.90%, 4.10, 2.70, 0.00, 0.05, 34.20%, 7.70%, 6.50%, -3.51%, -26.12%, 5.27%, 92.44%, 6.37%, 5.70%
70, AZPN, Aspen Technology Inc., Technology, Software - Application, USA, 9.51B, 27.89, 1.93, 13.22, 12.65, 34.99, -9.50%, -5.30%, 14.80%, 49.10%, 24.60%, 25.40%, 55.20%, 23.20%, 5.40, 5.40, 0.38, 0.41, 91.50%, 52.10%, 45.30%, 2.89%, -11.19%, 1.10%, 29.18%, 4.78%, 3.34%
72, BB, BlackBerry Limited, Technology, Software - Infrastructure, Canada, 5.59B, 173.62, -, 6.26, 3.79, 75.60, -616.70%, 220.00%, -, -655.60%, -25.50%, -36.60%, -61.90%, -49.40%, 2.30, 2.30, 0.48, 0.48, 72.00%, -, -, 11.15%, -7.70%, 70.39%, 117.03%, 51.89%, 5.85%
74, BDR, Blonder Tongue Laboratories Inc., Technology, Communication Equipment, USA, 14.99M, -, -, 0.96, 9.69, -, -, -, -, 83.30%, -19.50%, -, -, -, 1.30, 0.50, 2.07, 2.93, 24.80%, -, -, 16.67%, -21.74%, 14.55%, 137.74%, -5.26%, 9.54%
76, BELFB, Bel Fuse Inc., Technology, Electronic Components, USA, 168.17M, 14.33, -, 0.36, 1.09, -, -88.90%, 945.50%, -, -, 6.40%, -, -, -, -, -, -, -, -, -, -, 0.92%, -11.59%, 7.29%, 75.88%, 9.65%, 7.33%
78, BIGC, BigCommerce Holdings Inc., Technology, Software - Application, USA, 3.90B, -, -, 23.48, 17.60, -, 25.80%, 32.60%, -, -39.70%, 40.70%, -, -, -17.90%, 6.10, 6.10, 0.00, 0.00, 78.40%, -, -, -10.50%, -13.24%, -31.55%, -, -15.21%, 6.39%
80, BKI, Black Knight Inc., Technology, Software - Infrastructure, USA, 11.55B, 28.71, 3.96, 8.90, 4.37, 27.79, 135.90%, 14.82%, 10.75%, 3.00%, 20.30%, 4.80%, 10.40%, 5.10%, 1.40, 1.40, 0.86, 0.86, -, 22.00%, 20.70%, 0.56%, -5.34%, -19.40%, -4.66%, -16.93%, 2.26%
61, AUUD, Auddia Inc., Technology, Software - Application, USA, 26.60M, -, -, 133.02, -, -, -49.00%, -, -, 70.40%, -100.00%, -291.30%, 12.50%, 10.50%, 0.00, 0.00, -, -, -, -, -, -10.28%, -30.58%, -, -, -32.04%, 6.98%
63, AVLR, Avalara Inc., Technology, Software - Application, USA, 11.29B, 3003.86, -, 20.81, 10.44, 329.23, 11.30%, 116.70%, -, -78.90%, 37.90%, -4.70%, -6.90%, -5.00%, 2.10, 2.10, 0.00, 0.00, 71.70%, -12.50%, -11.80%, -9.92%, -18.96%, -20.59%, 23.45%, -19.84%, 5.02%
65, AVT, Avnet Inc., Technology, Electronics & Computer Distribution, USA, 4.42B, 12.33, 2.65, 0.24, 1.11, 12.62, -117.10%, 51.36%, 10.40%, 230.10%, -63.50%, 1.90%, 4.20%, 1.50%, 2.30, 1.30, 0.23, 0.30, 11.20%, 0.80%, 0.90%, -0.25%, 11.71%, 44.51%, 61.75%, 25.49%, 2.64%
67, AWRE, Aware Inc., Technology, Software - Application, USA, 79.50M, -, -, 6.52, 1.84, -, 8.50%, -, -, -36.80%, 25.70%, -15.40%, -17.20%, -17.00%, 8.00, 8.00, 0.00, 0.00, 91.60%, -78.10%, -65.50%, 5.26%, -15.93%, 22.19%, 7.04%, 8.57%, 6.24%
69, AYX, Alteryx Inc., Technology, Software - Application, USA, 5.17B, 177.15, -, 10.23, 11.52, 96.06, -193.30%, -, -4.95%, -157.40%, 9.20%, -3.60%, -11.20%, -0.10%, 4.10, 4.10, 1.47, 1.63, 91.80%, -2.50%, -9.80%, -6.34%, -19.14%, -33.75%, -45.97%, -36.14%, 4.06%
71, BAND, Bandwidth Inc., Technology, Software - Infrastructure, USA, 2.94B, 181.15, -, 7.58, 6.68, 439.26, -10.90%, 32.45%, -, -373.30%, 65.70%, -5.90%, -12.90%, -4.00%, 5.00, 4.90, 1.05, 1.05, 45.80%, -2.70%, -12.40%, -9.08%, -23.25%, -18.30%, 6.71%, -23.02%, 4.59%
73, BCOV, Brightcove Inc., Technology, Software - Application, USA, 596.82M, 23.27, 5.65, 2.90, 6.62, 36.84, 74.40%, 30.61%, 15.00%, 159.90%, 17.30%, 3.90%, 9.20%, -7.50%, 0.90, 0.90, 0.00, 0.00, 62.70%, 3.80%, 3.50%, -6.81%, -36.26%, -5.72%, 80.57%, -21.20%, 4.12%
75, BEEM, Beam Global, Technology, Solar, USA, 259.21M, -, -, 41.14, 8.39, -, 4.10%, 44.40%, -, 20.90%, 7.70%, -24.00%, -27.90%, -17.90%, 15.90, 15.10, 0.00, 0.00, -13.10%, -87.50%, -88.10%, -14.15%, -33.20%, -5.96%, 265.79%, -60.44%, 9.80%
77, BHE, Benchmark Electronics Inc., Technology, Electronic Components, USA, 1.12B, 21.60, 5.01, 0.55, 1.15, 10.35, -36.80%, 18.63%, 12.52%, 107.50%, -1.80%, 1.00%, 1.80%, 1.90%, 2.40, 1.70, 0.13, 0.14, 8.50%, 1.50%, 0.90%, 2.28%, 4.14%, 21.66%, 46.06%, 14.59%, 2.19%
79, BILL, Bill.com Holdings Inc., Technology, Software - Application, USA, 12.26B, -, -, 60.68, 14.14, -, -570.30%, 7.10%, 30.00%, -182.20%, 44.90%, -2.10%, -8.40%, -4.80%, 1.90, 1.90, 1.03, 1.03, 74.50%, -26.50%, -32.80%, -4.02%, -13.16%, 30.60%, 113.84%, 9.10%, 5.66%
82, BL, BlackLine Inc., Technology, Software - Infrastructure, USA, 6.03B, 152.00, -, 16.40, 17.71, 88.48, -40.40%, 51.66%, 9.90%, -194.50%, 19.70%, -6.00%, -18.40%, -2.50%, 5.10, 5.10, 3.14, 3.14, 79.70%, -10.40%, -19.80%, -11.20%, -18.52%, -9.77%, 39.93%, -22.05%, 4.26%
84, BLKB, Blackbaud Inc., Technology, Software - Application, USA, 3.44B, 23.67, -, 3.78, 8.04, 19.96, -35.70%, 8.30%, -6.90%, -103.60%, -2.00%, 0.20%, 0.70%, 2.40%, 0.70, 0.70, 1.29, 1.32, 53.10%, 3.90%, 0.30%, -0.27%, 0.38%, 25.56%, 20.61%, 22.81%, 2.95%
86, BMTX, BM Technologies Inc., Technology, Software - Application, USA, 150.35M, -, -, 2.25, 4.76, -, -161.90%, -, -, -417.30%, -1.50%, 0.30%, 0.40%, -, 0.00, 0.00, 0.00, 0.00, -, -, -, 29.80%, 2.39%, 22.50%, 18.54%, -8.48%, 5.50%
88, BNSO, Bonso Electronics International Inc., Technology, Scientific & Technical Instruments, Hong Kong, 34.20M, -, -, 2.03, 2.17, -, -, -, -, -, 84.30%, -, -, -, -, -, -, -, -, -, -, 12.92%, 22.42%, 58.14%, 205.24%, -9.10%, 6.94%
90, BOX, Box Inc., Technology, Software - Infrastructure, USA, 3.66B, 23.45, -, 4.74, 24.54, 25.11, 71.50%, 30.28%, 8.00%, 84.70%, 8.30%, -6.60%, -81.30%, -6.90%, 1.40, 1.40, 2.37, 2.70, 70.80%, -8.20%, -8.90%, 7.87%, 22.81%, 28.43%, 16.67%, 29.14%, 3.17%
92, BR, Broadridge Financial Solutions Inc., Technology, Information Technology Services, USA, 18.54B, 25.49, 3.12, 3.84, 11.62, 58.00, -2.70%, 10.37%, 11.60%, -1.90%, 11.20%, 10.50%, 35.70%, 16.20%, 1.40, 1.40, 1.09, 1.09, 28.70%, 14.40%, 10.70%, -1.23%, 8.87%, 9.03%, 31.69%, 4.10%, 1.74%
94, BRQS, Borqs Technologies Inc., Technology, Software - Application, China, 80.39M, -, -, 3.00, -, -, 1.90%, -, -, 79.70%, -87.80%, -53.10%, 111.00%, 68.10%, 0.30, 0.20, -, -, 6.00%, -, -, -17.22%, -46.88%, -18.68%, -37.06%, -6.89%, 6.42%
96, BSY, Bentley Systems Incorporated, Technology, Software - Application, USA, 15.92B, 79.56, 17.27, 19.20, 49.03, 53.66, 6.90%, 8.26%, 6.40%, 56.00%, 14.00%, 12.50%, 56.80%, 19.00%, 1.50, 1.50, 1.90, 1.90, 78.40%, 19.30%, 18.50%, 12.63%, 28.90%, 60.81%, -, 41.59%, 4.62%
98, BTRS, BTRS Holdings Inc., Technology, Software - Application, USA, 2.13B, -, -, 50.89, 6.30, -, 66.20%, 34.80%, -, -, 12.00%, -, -, -, 5.80, 5.80, 0.00, 0.00, 56.90%, -, -, -11.95%, -19.89%, 11.72%, 45.18%, -11.35%, 5.47%
100, CAJ, Canon Inc., Technology, Computer Hardware, Japan, 31.63B, 18.24, 25.91, 1.08, 1.03, 22.49, -32.10%, -9.66%, 1.00%, 105.50%, 7.70%, 2.30%, 4.10%, 2.60%, 1.40, 0.90, 0.00, 0.16, 43.50%, 4.60%, 3.30%, 0.00%, 9.24%, 26.74%, 16.37%, 23.08%, 1.26%
81, BKTI, BK Technologies Corporation, Technology, Communication Equipment, USA, 48.01M, -, 3.00, 1.15, 2.26, 60.02, 109.50%, -, 22.50%, 41.60%, -21.10%, 2.10%, 3.40%, 4.60%, 2.30, 1.30, 0.01, 0.05, 41.30%, 2.60%, 1.80%, -19.55%, -10.93%, 22.71%, 38.16%, 29.04%, 6.04%
83, BLIN, Bridgeline Digital Inc., Technology, Software - Infrastructure, USA, 16.59M, 14.76, -, 1.51, 2.32, -, 92.80%, 230.80%, -, -161.70%, 7.40%, -18.30%, -57.90%, -15.40%, 0.80, 0.80, 0.28, 0.41, 63.90%, 12.40%, -21.30%, -9.71%, -17.70%, 9.13%, 47.65%, -2.71%, 6.74%
85, BMBL, Bumble Inc., Technology, Software - Application, USA, 5.51B, 145.49, -, 8.69, 6.73, -, -319.90%, -80.49%, 79.10%, -, 43.30%, -, -, -3.90%, 2.00, 2.00, 0.44, 0.45, -, -21.10%, -, -21.55%, -35.95%, -, -, -32.13%, 6.54%
87, BNFT, Benefitfocus Inc., Technology, Software - Application, USA, 473.43M, -, -, 1.77, -, 14.61, 38.20%, 47.60%, 20.00%, 66.60%, -1.70%, -5.60%, 40.10%, -0.80%, 3.90, 3.90, -, -, 53.50%, 2.80%, -7.70%, 7.33%, -2.50%, 14.47%, 16.18%, 2.14%, 3.57%
89, BOSC, B.O.S. Better Online Solutions Ltd., Technology, Communication Equipment, Israel, 17.08M, -, -, 0.51, 1.36, -, 0.80%, -, -, 87.10%, -2.70%, -3.70%, -7.30%, -4.70%, 2.10, 1.40, 0.07, 0.13, 18.20%, -1.60%, -2.60%, 15.51%, 17.36%, 36.70%, 81.59%, 60.79%, 8.37%
91, BOXL, Boxlight Corporation, Technology, Communication Equipment, USA, 143.10M, -, -, 1.73, 2.91, -, 55.60%, 39.10%, -, 36.30%, 486.00%, -18.50%, -54.50%, -19.20%, 1.60, 1.00, 0.10, 0.43, 20.40%, -19.80%, -24.20%, -7.06%, -17.49%, 73.61%, 193.63%, 63.40%, 8.46%
93, BRKS, Brooks Automation Inc., Technology, Semiconductor Equipment & Materials, USA, 7.42B, 38.25, 6.74, 7.40, 5.99, 90.44, 286.60%, 9.43%, 12.00%, 158.20%, 30.20%, 5.80%, 7.50%, 5.40%, 2.70, 2.20, 0.04, 0.04, 44.40%, 11.40%, 9.20%, -0.98%, 14.23%, 45.01%, 155.42%, 50.46%, 4.81%
95, BSQR, BSQUARE Corporation, Technology, Software - Application, USA, 30.59M, -, -, 0.76, 3.70, -, 79.80%, -, -, -79.60%, -40.10%, -10.70%, -27.00%, -18.00%, 1.70, 1.70, 0.00, 0.20, 16.70%, -5.60%, -5.60%, -13.62%, -56.64%, 50.00%, 51.01%, 46.05%, 10.09%
97, BTBT, Bit Digital Inc., Technology, Software - Application, USA, 455.71M, -, -, 6.30, 5.45, -, 148.00%, -, -, 665.00%, -, 99.60%, 104.50%, 2.90%, 11.10, 11.10, 0.00, 0.02, 55.60%, 37.70%, 52.50%, -36.47%, -48.94%, 16.23%, 784.82%, -61.43%, 11.75%
