210, SXC, SunCoke Energy Inc., Basic Materials, Coking Coal, USA, 634.78M, 15.53, 5.14, 0.48, 1.30, 6.07, 102.20%, 4.30%, 8.00%, 238.40%, -6.00%, 0.90%, 3.20%, 5.70%, 1.50, 0.60, 1.34, 1.34, 22.30%, 6.30%, 1.20%, 10.09%, 14.61%, 58.53%, 120.82%, 73.10%, 5.30%
212, SYNL, Synalloy Corporation, Basic Materials, Steel, USA, 88.73M, -, -, 0.35, 1.11, 6.12, -823.20%, -, 12.40%, 190.70%, -6.60%, -11.10%, -28.70%, -19.40%, 3.80, 1.30, 0.77, 0.78, 9.70%, -11.20%, -10.00%, 3.03%, 10.65%, 64.50%, 5.67%, 26.54%, 5.11%
214, TG, Tredegar Corporation, Basic Materials, Specialty Chemicals, USA, 516.33M, -, 1.73, 0.69, 4.39, -, -128.70%, -, 21.90%, 146.10%, -3.90%, -, -, 22.80%, 1.50, 0.90, 1.23, 1.23, 22.50%, -, -, 2.90%, -3.97%, 30.13%, 40.58%, -8.74%, 2.91%
216, THM, International Tower Hill Mines Ltd., Basic Materials, Gold, Canada, 228.40M, -, -, -, 3.37, -, -16.60%, -, -, -, -, -8.60%, -8.70%, -, 28.80, 28.80, 0.00, 0.00, -, -, -, 13.37%, -2.14%, -15.81%, 1.33%, -17.03%, 5.28%
218, TMST, TimkenSteel Corporation, Basic Materials, Steel, USA, 681.90M, 9.35, -, 0.81, 1.34, 6.40, 44.00%, -6.36%, -, 139.70%, 5.40%, -3.20%, -6.20%, -11.20%, 1.90, 1.00, 0.09, 0.17, 4.60%, -5.70%, -3.80%, 25.10%, 75.75%, 197.06%, 332.86%, 224.41%, 7.58%
220, TROX, Tronox Holdings plc, Basic Materials, Chemicals, USA, 3.62B, 9.63, 0.07, 1.24, 1.91, 13.99, 920.40%, 27.58%, 48.90%, -44.60%, 23.40%, 15.20%, 67.50%, 23.20%, 2.10, 1.30, 1.60, 1.88, 22.20%, 9.00%, 32.70%, 6.73%, 29.87%, 85.76%, 253.61%, 60.60%, 3.98%
201, SNES, SenesTech Inc., Basic Materials, Specialty Chemicals, USA, 19.89M, -, -, 66.31, 0.83, -, 63.80%, 46.30%, 30.00%, 86.80%, 51.60%, -82.00%, -107.50%, -168.80%, 33.50, 31.70, 0.04, 0.05, 0.00%, -, -, 0.62%, -11.48%, 3.40%, -15.18%, -6.09%, 6.26%
203, SQM, Sociedad Quimica y Minera de Chile S.A., Basic Materials, Chemicals, Chile, 12.02B, 24.23, 3.19, 6.15, 5.31, -, -40.80%, 40.39%, 19.10%, 51.10%, 34.80%, 3.90%, 8.90%, 5.70%, 5.10, 3.00, 0.89, 0.91, 26.20%, 17.10%, 9.60%, -17.86%, -20.90%, -10.28%, 79.89%, -11.65%, 4.22%
205, STLD, Steel Dynamics Inc., Basic Materials, Steel, USA, 13.09B, 12.87, 4.85, 1.24, 2.79, -, -14.70%, -49.14%, 3.44%, 131.70%, 37.60%, 8.70%, 18.20%, 9.60%, 2.90, 1.60, 0.64, 0.66, 17.20%, 11.00%, 7.50%, 12.93%, 41.85%, 64.81%, 135.05%, 69.32%, 3.70%
207, SUZ, Suzano S.A., Basic Materials, Paper & Paper Products, Brazil, 16.00B, -, -, 0.53, 2.21, -, -, -, -, 405.80%, 13.70%, -, -, -, -, -, -, -, -, -, -, -6.83%, -10.49%, 24.97%, 67.51%, 6.08%, 2.68%
209, SWM, Schweitzer-Mauduit International Inc., Basic Materials, Paper & Paper Products, USA, 1.35B, 10.41, 3.08, 1.23, 1.94, 16.02, -1.70%, 18.02%, 5.00%, -4.90%, 10.20%, 5.20%, 13.10%, 8.90%, 2.70, 1.60, 0.94, 0.95, 28.60%, 11.60%, 7.50%, -10.23%, -14.95%, 14.69%, 34.62%, 1.74%, 2.88%
211, SXT, Sensient Technologies Corporation, Basic Materials, Specialty Chemicals, USA, 3.66B, 25.47, 8.04, 2.73, 3.96, 41.78, 33.30%, 12.34%, 3.80%, 52.20%, 2.60%, 7.00%, 13.30%, 8.50%, 3.70, 1.90, 0.57, 0.57, 32.10%, 12.30%, 9.00%, 4.13%, 10.95%, 18.92%, 73.08%, 17.60%, 1.52%
213, TECK, Teck Resources Limited, Basic Materials, Other Industrial Metals & Mining, Canada, 13.18B, 8.96, -, 1.74, 0.78, -, -49.60%, 8.71%, 13.18%, 198.80%, 7.20%, -0.60%, -1.20%, -2.60%, 1.20, 0.60, 0.39, 0.41, 17.80%, 0.40%, -2.70%, 12.68%, 17.39%, 58.80%, 160.38%, 36.14%, 4.57%
215, TGB, Taseko Mines Limited, Basic Materials, Other Industrial Metals & Mining, Canada, 701.91M, 17.41, -, 2.30, 2.77, 25.62, 57.10%, 25.44%, -, 80.10%, 39.60%, 1.50%, 4.70%, 2.20%, 3.70, 3.10, 1.70, 1.77, 16.20%, 4.60%, 3.90%, 20.87%, 44.77%, 180.28%, 527.05%, 88.64%, 7.24%
217, TMQ, Trilogy Metals Inc., Basic Materials, Other Industrial Metals & Mining, Canada, 402.58M, -, -, -, 2.22, -, 63.20%, -, -, -, -, -, -, -, -, -, -, -, -, -, -, 23.45%, 24.00%, 64.12%, 48.40%, 39.50%, 5.33%
219, TREC, Trecora Resources, Basic Materials, Specialty Chemicals, USA, 203.93M, -, -, 1.01, 1.02, 22.66, 137.50%, -, 17.50%, -176.40%, -12.10%, 5.00%, 8.10%, 2.70%, 3.30, 2.90, 0.24, 0.26, 11.40%, -1.70%, 8.00%, 8.48%, 11.73%, 20.26%, 28.17%, 17.17%, 2.52%
222, TRX, Tanzanian Gold Corporation, Basic Materials, Gold, Canada, 128.30M, -, -, -, 2.19, -, 58.80%, -, -, 109.50%, -, -20.00%, -29.30%, -, 2.50, 2.40, 0.00, 0.00, -, -, -, -10.81%, -28.37%, -15.83%, -40.69%, -23.60%, 4.44%
224, TX, Ternium S.A., Basic Materials, Steel, Luxembourg, 7.26B, 5.79, 0.20, 0.75, 0.92, 5.98, 38.00%, -38.78%, 26.17%, -, 43.10%, 10.90%, 19.60%, 8.50%, 2.40, 1.40, 0.17, 0.25, 24.70%, 19.00%, 14.30%, -9.20%, 12.68%, 35.24%, 130.40%, 25.89%, 3.95%
226, UAN, CVR Partners LP, Basic Materials, Agricultural Inputs, USA, 634.16M, -, -, 1.89, 2.21, 234.88, -184.10%, -, 8.00%, -29.70%, -18.90%, -9.90%, -31.80%, -3.70%, 1.30, 0.80, 2.20, 2.21, 27.10%, -13.10%, -30.60%, 3.86%, 146.85%, 561.74%, 551.52%, 271.35%, 8.45%
228, UFS, Domtar Corporation, Basic Materials, Paper & Paper Products, USA, 2.71B, 12.85, -, 0.82, 1.39, 16.25, -291.30%, 0.91%, 5.00%, 51.10%, -8.40%, -3.50%, -7.30%, -3.10%, 2.20, 1.40, 0.24, 0.39, 13.10%, -5.90%, -4.90%, 35.57%, 50.18%, 73.93%, 165.83%, 71.34%, 1.62%
230, USAP, Universal Stainless & Alloy Products Inc., Basic Materials, Steel, USA, 91.16M, -, -, 0.58, 0.43, 3.59, -548.30%, 95.20%, 3.15%, -217.80%, -36.80%, -6.90%, -9.60%, -6.20%, 5.60, 1.10, 0.22, 0.23, -4.90%, -17.00%, -14.00%, 21.20%, 0.75%, 51.41%, 37.12%, 43.72%, 5.71%
232, USAU, U.S. Gold Corp., Basic Materials, Gold, USA, 86.48M, -, -, -, 2.19, -, 27.30%, 61.30%, -, -68.20%, -, -84.10%, -87.40%, -, 25.50, 25.50, 0.00, 0.00, -, -, -, 14.70%, 17.45%, 17.56%, 39.36%, -25.98%, 4.27%
234, USLM, United States Lime & Minerals Inc., Basic Materials, Building Materials, USA, 788.98M, -, -, 4.81, 3.15, 19.97, 8.00%, -, -, 26.10%, 8.60%, 10.80%, 12.40%, 11.50%, 12.20, 10.80, 0.00, 0.00, 30.20%, 21.90%, 18.10%, -0.18%, -4.35%, 28.37%, 87.63%, 22.06%, 2.07%
236, VEDL, Vedanta Limited, Basic Materials, Other Industrial Metals & Mining, India, 13.68B, -, -, 1.29, 1.89, 7.30, -223.70%, -, -, 325.70%, -59.00%, -3.90%, -12.60%, -1.20%, 1.00, 0.80, 0.74, 1.18, 3.50%, -1.90%, -9.10%, 5.48%, 24.00%, 137.66%, 203.89%, 68.91%, 2.15%
238, VHI, Valhi Inc., Basic Materials, Chemicals, USA, 735.08M, 4.54, 0.70, 0.39, 1.05, 4.68, 3.50%, 30.41%, 25.50%, -39.30%, 10.80%, 1.60%, 9.10%, 7.80%, 4.70, 3.10, 1.09, 1.09, 22.20%, 7.30%, 2.40%, -5.09%, 39.18%, 58.96%, 173.42%, 69.21%, 8.61%
240, VNTR, Venator Materials PLC, Basic Materials, Specialty Chemicals, United Kingdom, 516.98M, 10.27, -, 0.26, 0.90, 19.15, 36.10%, 176.57%, 30.10%, -398.90%, 3.90%, -6.00%, -22.20%, -5.10%, 2.50, 1.50, 1.61, 1.62, 7.80%, -4.30%, -7.10%, 3.54%, 28.76%, 118.94%, 279.39%, 50.15%, 7.91%
221, TRQ, Turquoise Hill Resources Ltd., Basic Materials, Copper, Canada, 3.60B, 17.77, 3.06, 2.44, 0.37, -, 370.00%, -64.64%, 2.00%, 327.20%, 302.80%, -, -, 3.50%, 2.40, 1.90, 0.43, 0.43, 48.80%, -, -, 0.17%, 15.80%, 85.09%, 141.00%, 43.96%, 5.77%
223, TSE, Trinseo S.A., Basic Materials, Specialty Chemicals, USA, 2.52B, 8.45, 3.76, 0.77, 3.70, 13.11, -90.90%, -23.56%, 5.95%, 292.00%, 28.00%, 4.00%, 20.30%, 3.00%, 3.30, 2.60, 2.37, 2.39, 13.70%, 8.80%, 3.50%, 2.77%, -6.41%, 61.99%, 215.55%, 26.81%, 4.30%
225, UAMY, United States Antimony Corporation, Basic Materials, Other Industrial Metals & Mining, USA, 88.50M, -, -, 18.83, 2.50, -, 14.70%, -, -, 18.70%, -23.50%, -17.50%, -24.00%, -, 8.10, 7.90, 0.02, 0.02, 6.70%, -69.30%, -70.80%, -6.59%, -47.20%, 75.29%, 147.60%, 62.84%, 8.08%
227, UFPI, UFP Industries Inc., Basic Materials, Lumber & Wood Production, USA, 4.94B, 12.85, 0.93, 0.83, 3.05, -, 37.40%, 0.54%, 17.00%, 155.40%, 76.80%, -, -, 14.60%, 2.80, 1.50, 0.27, 0.30, 15.50%, -, -, -6.38%, 25.92%, 47.12%, 73.89%, 43.15%, 3.05%
229, UNVR, Univar Solutions Inc., Basic Materials, Chemicals, USA, 4.59B, 14.45, 4.11, 0.56, 2.45, 41.99, 148.40%, 13.84%, 17.75%, 18.10%, -2.50%, 1.00%, 3.60%, 5.00%, 1.70, 1.20, 1.28, 1.35, 24.50%, 2.70%, 0.80%, 14.16%, 33.19%, 48.03%, 75.23%, 42.50%, 2.46%
231, USAS, Americas Gold and Silver Corporation, Basic Materials, Other Industrial Metals & Mining, Canada, 231.49M, 5.80, -, 8.30, 1.21, -, -, 600.00%, -, -, -33.90%, -, -, -, -, -, -, -, -, -, -, -19.82%, -30.40%, -35.32%, -29.84%, -46.13%, 6.57%
233, USCR, U.S. Concrete Inc., Basic Materials, Building Materials, USA, 975.10M, 16.98, 3.30, 0.74, 2.60, 9.72, 46.50%, 39.35%, 14.00%, -52.10%, -14.60%, 1.50%, 6.40%, 6.10%, 1.30, 1.00, 1.93, 2.02, 22.90%, 4.70%, 1.80%, -12.43%, 3.34%, 52.22%, 173.20%, 42.58%, 5.24%
235, VALE, Vale S.A., Basic Materials, Other Industrial Metals & Mining, Brazil, 111.97B, 5.87, 0.30, 2.38, 2.79, 13.22, 500.30%, -22.19%, 34.03%, 3006.10%, 121.80%, 12.00%, 29.10%, 18.60%, 2.00, 1.60, 0.35, 0.38, 57.50%, 34.20%, 22.80%, 2.18%, 23.83%, 51.80%, 126.25%, 29.51%, 3.08%
237, VGZ, Vista Gold Corp., Basic Materials, Gold, USA, 120.60M, -, -, -, 8.77, -, 104.30%, -, -, 13.90%, -, 4.80%, 5.60%, -, 3.70, 3.70, 0.00, 0.00, -, -, -, 4.59%, 20.27%, 19.37%, 26.25%, 5.56%, 4.99%
239, VMC, Vulcan Materials Company, Basic Materials, Building Materials, USA, 24.61B, 29.94, 2.32, 5.05, 3.97, 37.71, -5.40%, 16.21%, 15.25%, 169.10%, 1.80%, 6.00%, 11.50%, 7.90%, 3.50, 2.70, 0.45, 0.46, 26.80%, 21.20%, 14.00%, 0.90%, 6.61%, 27.29%, 69.24%, 23.61%, 2.08%
242, WDFC, WD-40 Company, Basic Materials, Specialty Chemicals, USA, 3.43B, 43.48, 4.49, 7.68, 17.88, 88.39, -5.20%, 5.04%, 10.00%, 20.20%, 11.90%, 19.40%, 44.80%, 22.80%, 3.10, 2.50, 0.62, 0.63, 55.60%, 20.90%, 16.70%, -1.11%, -22.20%, -3.01%, 27.60%, -7.86%, 2.36%
244, WLK, Westlake Chemical Corporation, Basic Materials, Specialty Chemicals, USA, 12.97B, 14.50, 0.67, 1.64, 2.06, 15.06, -21.10%, -18.56%, 45.44%, 66.80%, 22.00%, 3.10%, 7.10%, 4.90%, 2.80, 2.10, 0.57, 0.57, 15.80%, 8.10%, 5.40%, 4.15%, 15.90%, 29.62%, 111.47%, 23.62%, 2.78%
246, WOR, Worthington Industries Inc., Basic Materials, Steel, USA, 3.58B, 16.91, 0.14, 1.28, 2.64, 20.74, -46.00%, -16.84%, 41.50%, 363.80%, -0.60%, 21.50%, 52.30%, -0.50%, 2.60, 2.00, 0.54, 0.54, 17.90%, 2.30%, 22.30%, 0.15%, -3.96%, 25.06%, 121.82%, 29.28%, 3.63%
248, WRN, Western Copper and Gold Corporation, Basic Materials, Other Industrial Metals & Mining, Canada, 355.79M, -, -, -, 4.30, -, -, -, -, -, -, -, -, -, -, -, -, -, -, -, -, 71.24%, 63.75%, 118.33%, 231.60%, 113.01%, 9.54%
250, X, United States Steel Corporation, Basic Materials, Steel, USA, 7.03B, 12.75, -, 0.66, 1.40, -, -61.10%, -73.86%, 8.00%, 115.10%, 33.30%, -5.40%, -17.60%, -10.80%, 1.40, 0.80, 1.25, 1.26, 5.90%, -5.00%, -6.40%, 15.24%, 41.69%, 80.32%, 222.51%, 54.62%, 7.03%
252, YTEN, Yield10 Bioscience Inc., Basic Materials, Agricultural Inputs, USA, 40.13M, -, -, 50.16, 1.53, -, 87.90%, 3.60%, 0.00%, 71.90%, 0.00%, -50.90%, -69.20%, -98.20%, 15.90, 15.90, 0.00, 0.00, -, -, -, -15.05%, -48.60%, 20.64%, 37.33%, 42.56%, 10.20%
254, ZKIN, ZK International Group Co. Ltd., Basic Materials, Steel, China, 110.88M, -, -, 1.28, 1.62, -, -110.20%, -, -, -123.10%, 65.00%, -1.00%, -1.90%, 0.10%, 1.60, 1.10, 0.01, 0.40, 4.50%, -1.50%, -1.00%, -31.57%, -40.86%, 92.98%, 307.41%, 69.88%, 10.03%
241, VRS, Verso Corporation, Basic Materials, Paper & Paper Products, USA, 553.17M, 189.00, -, 0.41, 0.84, -, -248.10%, 104.50%, -, -184.80%, -46.50%, -6.90%, -11.60%, -17.30%, 2.70, 1.40, 0.01, 0.01, 1.80%, -9.40%, -7.40%, 11.47%, 35.75%, 54.78%, 49.39%, 41.51%, 3.59%
243, WFG, West Fraser Timber Co. Ltd., Basic Materials, Lumber & Wood Production, Canada, 9.20B, -, -, 1.57, -, -, -, -, -, -, 49.60%, -, -, -, -, -, -, -, -, -, -, -1.24%, 13.80%, 36.08%, 178.99%, 19.84%, 4.27%
245, WLKP, Westlake Chemical Partners LP, Basic Materials, Chemicals, USA, 959.42M, 11.98, 1.88, 0.97, 1.84, 3.06, 6.30%, 16.78%, 8.00%, -14.70%, 7.10%, 4.70%, 12.20%, 38.30%, 6.50, 6.50, 0.77, 0.77, 36.90%, 34.00%, 6.50%, -0.07%, 15.71%, 22.95%, 32.24%, 13.72%, 1.76%
247, WPM, Wheaton Precious Metals Corp., Basic Materials, Gold, Canada, 21.52B, 30.13, 2.01, 18.47, 3.71, 29.25, 485.40%, 6.05%, 18.75%, 70.10%, 27.20%, 9.50%, 10.20%, 8.80%, 2.10, 2.10, 0.00, 0.00, 54.70%, 49.20%, 49.30%, 14.25%, 34.59%, 24.57%, 11.67%, 15.05%, 2.85%
249, WWR, Westwater Resources Inc., Basic Materials, Other Industrial Metals & Mining, USA, 138.09M, -, -, -, 0.97, -, 48.40%, -, 20.00%, 65.10%, -, -, -, -, 23.00, 23.00, 0.00, 0.00, -, -, -, -6.44%, -28.64%, -26.66%, 90.50%, -14.60%, 7.30%
251, XPL, Solitario Zinc Corp., Basic Materials, Other Industrial Metals & Mining, USA, 39.87M, -, -, -, 1.68, -, 71.40%, -, -, 13.20%, -, -3.60%, -3.60%, -, 44.00, 44.00, 0.00, 0.00, -, -, -, -6.93%, -34.07%, 37.24%, 115.20%, 19.60%, 6.35%
253, ZEUS, Olympic Steel Inc., Basic Materials, Steel, USA, 405.40M, 22.27, 0.76, 0.30, 1.27, 10.37, -245.90%, -66.94%, 34.29%, -, 30.70%, 2.40%, 5.20%, 0.40%, 2.90, 1.30, 0.60, 0.60, 15.60%, 2.20%, 1.20%, 22.35%, 83.90%, 134.27%, 224.12%, 168.19%, 8.90%
255, ZY, Zymergen Inc., Basic Materials, Chemicals, USA, 3.17B, -, -, 238.73, -, -, -, -, -, -, -, -, -, -, -, -, -, -, -, -, -, -33.13%, -, -, -, -14.00%, 10.88%
