104, HUN, Huntsman Corporation, Basic Materials, Chemicals, USA, 6.30B, 9.94, 1.36, 1.01, 1.76, -, -31.30%, 8.22%, 11.39%, 214.20%, 15.30%, 5.00%, 12.30%, 6.90%, 1.90, 1.20, 0.43, 0.44, 19.10%, 8.10%, 6.60%, -3.34%, 2.31%, 10.69%, 56.36%, 12.89%, 2.77%
106, HYMC, Hycroft Mining Holding Corporation, Basic Materials, Other Precious Metals & Mining, USA, 228.22M, 160.80, -, 4.15, 30.92, -, 98.80%, 105.40%, -, 93.50%, 71.20%, -54.30%, -, -54.40%, 3.20, 2.60, 19.18, 20.16, -89.60%, -, -, 13.24%, -42.24%, -48.40%, -68.22%, -48.79%, 7.43%
108, ICL, ICL Group Ltd, Basic Materials, Agricultural Inputs, Israel, 9.23B, -, 204.84, 1.76, 2.34, -, -, -, 3.90%, 125.00%, 14.50%, -, -, -, -, -, -, -, -, -, -, 10.28%, 22.91%, 52.65%, 107.80%, 42.38%, 2.57%
110, IFFT, International Flavors & Fragrances Inc., Basic Materials, Specialty Chemicals, USA, -, -, -, -, 0.85, -, -, -, -, -19.10%, -1.10%, -, -, -, -, -, -, -, -, -, -, -0.54%, 0.48%, 19.91%, 4.16%, 22.53%, 1.07%
112, IOSP, Innospec Inc., Basic Materials, Specialty Chemicals, USA, 2.50B, 20.63, 18.00, 2.16, 2.59, 20.65, -74.50%, 19.02%, 7.50%, -29.60%, -8.80%, 1.40%, 2.00%, 2.40%, 2.20, 1.40, 0.00, 0.00, 28.40%, 1.80%, 1.60%, 2.03%, -0.38%, 15.61%, 31.16%, 11.44%, 2.68%
114, ITP, IT Tech Packaging Inc., Basic Materials, Paper & Paper Products, China, 47.34M, -, -, 0.41, 0.08, -, -307.90%, -, 20.00%, -8.60%, 178.20%, -3.60%, -4.20%, -2.20%, 3.00, 2.70, 0.02, 0.08, 6.60%, -2.50%, -6.40%, -13.80%, -40.20%, -34.73%, 1.51%, -14.39%, 8.39%
116, JCTCF, Jewett-Cameron Trading Company Ltd., Basic Materials, Lumber & Wood Production, USA, 34.56M, -, -, 0.68, 1.75, -, 54.90%, -, -, 68.80%, 38.20%, 14.80%, 17.70%, 13.80%, 6.20, 3.00, 0.01, 0.04, 27.40%, 8.90%, 6.70%, -1.51%, -5.89%, 6.92%, 69.74%, 12.94%, 1.33%
118, KALU, Kaiser Aluminum Corporation, Basic Materials, Aluminum, USA, 2.08B, 18.87, -, 1.85, 2.78, 35.05, -52.70%, 18.35%, -2.62%, -84.50%, -12.30%, 0.20%, 0.60%, 4.50%, 2.70, 1.60, 1.15, 1.15, 18.60%, 4.60%, 0.40%, 7.57%, 7.51%, 63.02%, 80.33%, 30.83%, 5.07%
120, KL, Kirkland Lake Gold Ltd., Basic Materials, Gold, Canada, 11.57B, -, -, 4.70, 2.28, -, -, -, -, 37.50%, 67.70%, -, -, -, -, -, -, -, -, -, -, 15.39%, 33.16%, 9.36%, 12.66%, 4.99%, 2.73%
101, HL, Hecla Mining Company, Basic Materials, Gold, USA, 4.80B, 30.51, -, 6.27, 2.79, 43.99, 83.90%, 42.51%, -, 205.20%, 54.10%, 0.70%, 1.10%, 2.30%, 2.70, 1.90, 0.30, 0.30, 26.00%, 13.70%, 2.50%, 49.38%, 45.05%, 86.88%, 171.31%, 39.01%, 6.42%
103, HUDI, Huadi International Group Co. Ltd., Basic Materials, Steel, China, 65.59M, -, -, 1.11, -, 26.23, 23.20%, -, -, -80.20%, 0.60%, -, -, 7.30%, 1.10, 0.60, 0.00, 1.28, 18.00%, 7.50%, 5.60%, 3.45%, -10.21%, -, -, -28.47%, 8.48%
105, HWKN, Hawkins Inc., Basic Materials, Specialty Chemicals, USA, 716.80M, -, -, 1.20, 5.57, 30.63, 16.90%, -, -, 74.10%, 18.70%, 8.00%, 13.50%, 10.60%, 2.60, 1.50, 0.33, 0.37, 20.70%, 7.90%, 5.60%, 1.55%, 6.41%, 31.38%, 58.60%, 30.07%, 3.42%
107, IAG, IAMGOLD Corporation, Basic Materials, Gold, Canada, 1.70B, 11.79, 6.42, 1.35, 0.69, 3.61, 110.10%, 38.29%, 3.00%, 155.40%, 8.30%, 2.40%, 4.00%, 3.20%, 3.50, 2.70, 0.20, 0.21, 20.80%, 10.90%, 7.60%, 13.48%, 25.26%, 8.71%, -3.21%, -1.36%, 3.92%
109, IFF, International Flavors & Fragrances Inc., Basic Materials, Specialty Chemicals, USA, 35.56B, 21.38, 10.06, 5.73, 1.35, -, -20.60%, 14.95%, 7.72%, -118.20%, 83.00%, -, -, 4.60%, 1.90, 1.10, 0.52, 0.55, 36.70%, -, -, -1.71%, 1.81%, 26.04%, 6.37%, 30.16%, 1.96%
111, IKNX, IKONICS Corporation, Basic Materials, Specialty Chemicals, USA, 18.03M, -, -, 1.39, 1.61, -, 45.90%, -, -, 45.20%, -11.40%, -1.10%, -1.60%, -10.90%, 2.00, 1.50, 0.00, 0.23, 28.80%, -10.00%, -1.30%, -5.39%, -5.25%, 72.35%, 180.30%, -5.81%, 5.62%
113, IPI, Intrepid Potash Inc., Basic Materials, Agricultural Inputs, USA, 381.22M, 35.78, -, 1.87, 0.90, 10.80, -300.90%, -9.09%, -, 132.30%, 11.70%, -3.10%, -4.20%, -5.30%, 2.00, 1.00, 0.04, 0.06, 6.90%, -6.60%, -8.50%, -13.14%, -6.59%, 111.84%, 132.68%, 18.51%, 8.46%
115, ITRG, Integra Resources Corp., Basic Materials, Other Precious Metals & Mining, Canada, 175.90M, -, -, -, -, -, -, -, -, -, -, -, -, -, -, -, -, -, -, -, -, 5.94%, 1.90%, -5.03%, 29.70%, -18.11%, 4.49%
117, JHX, James Hardie Industries plc, Basic Materials, Building Materials, Ireland, 14.51B, 21.51, 3.69, 4.99, 13.68, 21.45, 8.50%, 35.71%, 15.00%, 1455.60%, 19.90%, 6.30%, 22.90%, 16.20%, 1.00, 0.80, 0.81, 0.81, 36.20%, 15.80%, 9.00%, -3.88%, 10.36%, 14.31%, 94.21%, 12.69%, 1.75%
119, KGC, Kinross Gold Corporation, Basic Materials, Gold, Canada, 10.08B, 9.13, -, 2.33, 1.52, 10.38, 71.20%, 44.70%, -7.40%, 23.70%, 12.10%, 13.00%, 22.10%, 15.70%, 2.20, 1.10, 0.22, 0.30, 40.30%, 45.10%, 31.70%, 13.92%, 30.86%, 13.76%, 23.66%, 10.35%, 3.15%
122, KOR, Corvus Gold Inc., Basic Materials, Gold, USA, -, -, -, -, -, -, -, -, -, -, -, -, -, -, -, -, -, -, -, -, -, 50.24%, 70.88%, 34.05%, 26.94%, 30.67%, 5.45%
124, KRO, Kronos Worldwide Inc., Basic Materials, Specialty Chemicals, USA, 1.89B, 15.18, 1.18, 1.12, 2.34, 68.61, -26.50%, 18.23%, 28.12%, -27.30%, 10.50%, 2.90%, 7.10%, 7.90%, 4.70, 2.80, 0.58, 0.58, 21.30%, 6.30%, 3.40%, -7.04%, 8.77%, 15.18%, 66.39%, 8.92%, 3.15%
126, LAC, Lithium Americas Corp., Basic Materials, Other Industrial Metals & Mining, Canada, 1.83B, -, -, -, 8.11, -, -, -, -, -, -, -, -, -, -, -, -, -, -, -, -, 4.94%, -19.43%, 38.34%, 271.36%, 21.91%, 5.97%
128, LIN, Linde plc, Basic Materials, Specialty Chemicals, United Kingdom, 156.51B, 27.40, 6.08, 5.64, 3.40, 56.66, 17.40%, 10.52%, 9.00%, 74.10%, 7.50%, 3.40%, 6.30%, 3.90%, 0.70, 0.60, 0.22, 0.34, 43.80%, 13.70%, 10.50%, 3.89%, 19.53%, 18.65%, 48.56%, 14.08%, 1.27%
130, LOOP, Loop Industries Inc., Basic Materials, Specialty Chemicals, Canada, 400.03M, -, -, -, 8.55, -, 26.30%, 28.90%, -, -245.20%, -, -63.50%, -71.50%, -, 11.10, 11.10, 0.05, 0.05, -, -, -, 9.23%, -1.49%, 7.20%, 7.58%, 11.20%, 6.14%
132, LXU, LSB Industries Inc., Basic Materials, Chemicals, USA, 195.49M, -, -, 0.53, 1.44, -, -2.50%, 36.30%, 12.00%, 18.00%, 17.60%, -8.80%, -57.50%, -1.70%, 1.10, 1.00, 3.74, 3.95, 6.20%, -2.50%, -25.80%, -0.94%, 28.89%, 154.66%, 482.41%, 85.55%, 6.96%
134, MAG, MAG Silver Corp., Basic Materials, Silver, Canada, 2.01B, 17.06, -, -, 6.55, -, -51.60%, 50.00%, -, 77.60%, -, 1.40%, 1.40%, -, 107.30, 107.30, 0.00, 0.00, -, -, -, 21.55%, 17.05%, 46.09%, 72.33%, 4.73%, 4.68%
136, MDU, MDU Resources Group Inc., Basic Materials, Building Materials, USA, 6.75B, 15.11, 2.25, 1.21, 2.19, 76.08, 15.40%, 6.15%, 7.20%, 18.10%, 0.50%, 4.70%, 12.60%, 8.60%, 1.40, 1.10, 0.72, 0.74, 91.60%, 9.50%, 6.70%, 0.54%, 17.40%, 30.01%, 54.69%, 27.79%, 1.69%
138, MERC, Mercer International Inc., Basic Materials, Paper & Paper Products, Canada, 968.76M, 7.25, -, 0.65, 1.72, 20.14, -78.20%, 12.60%, 5.73%, 273.60%, 17.70%, -0.40%, -1.40%, 3.20%, 4.10, 2.80, 2.20, 0.00, 12.20%, 4.10%, -0.50%, -11.67%, -5.36%, 71.96%, 83.89%, 44.78%, 4.00%
140, MKD, Molecular Data Inc., Basic Materials, Chemicals, China, 117.20M, -, -, 0.10, -, -, -51.20%, 80.00%, -, -111.80%, -38.30%, -56.10%, 386.70%, -222.70%, 1.00, 1.00, -, -, -0.10%, -4.40%, -4.30%, -12.47%, -42.91%, -31.78%, -50.91%, -4.17%, 6.80%
121, KOP, Koppers Holdings Inc., Basic Materials, Specialty Chemicals, USA, 729.11M, 7.16, 0.37, 0.44, 1.95, 13.53, 41.20%, 7.93%, 18.00%, 734.50%, 1.40%, 9.40%, 50.80%, 12.10%, 2.30, 1.20, 2.13, 2.15, 23.10%, 11.20%, 8.90%, 2.57%, -0.83%, 21.65%, 109.23%, 11.26%, 3.69%
123, KRA, Kraton Corporation, Basic Materials, Specialty Chemicals, USA, 1.12B, 13.37, -, 0.71, 1.72, -, -543.70%, 26.37%, -13.00%, -84.20%, 2.30%, -, -, -10.70%, 1.50, 0.70, 1.34, 1.48, 26.40%, -, -, -10.70%, -16.13%, 16.35%, 122.62%, 22.17%, 5.16%
125, KWR, Quaker Chemical Corporation, Basic Materials, Specialty Chemicals, USA, 4.33B, 28.39, 1.55, 2.95, 3.25, -, 7.00%, 17.52%, 26.27%, 234.80%, 13.50%, -, -, 2.90%, 2.10, 1.60, 0.65, 0.68, 36.50%, -, -, -0.25%, -15.37%, -2.70%, 41.97%, -4.28%, 2.85%
127, LGO, Largo Resources Ltd., Basic Materials, Other Industrial Metals & Mining, Canada, 944.35M, -, -, 8.01, -, -, -, -, -, -4.60%, -5.00%, -, -, -, -, -, -, -, -, -, -, -16.06%, 0.27%, 69.52%, 121.82%, 32.52%, 5.49%
129, LOMA, Loma Negra Compania Industrial Argentina Sociedad Anonima, Basic Materials, Building Materials, Argentina, 1.35B, 8.05, 3.24, 2.83, 1.40, -, 47.90%, 29.67%, 2.94%, 169.20%, 35.40%, -, -, 10.20%, 1.00, 0.60, 0.02, 0.14, 32.00%, -, -, 11.76%, 17.49%, 17.70%, 43.94%, 8.13%, 4.10%
131, LTHM, Livent Corporation, Basic Materials, Specialty Chemicals, USA, 2.91B, 55.90, -, 9.36, 5.33, -, -137.60%, 188.43%, 6.41%, 58.00%, 33.90%, -1.90%, -3.20%, -1.80%, 4.00, 2.40, 0.56, 0.56, 12.70%, -5.60%, -5.70%, 7.49%, 1.40%, 23.95%, 189.47%, 3.56%, 5.63%
133, LYB, LyondellBasell Industries N.V., Basic Materials, Specialty Chemicals, USA, 37.97B, 8.80, 0.40, 1.29, 4.27, 94.92, -55.80%, -12.38%, 39.72%, 658.90%, 21.20%, 7.00%, 29.90%, 6.70%, 1.70, 1.10, 1.57, 1.75, 14.20%, 8.00%, 8.00%, 4.77%, 5.91%, 26.07%, 76.63%, 22.87%, 2.64%
135, MBII, Marrone Bio Innovations Inc., Basic Materials, Agricultural Inputs, USA, 254.20M, -, -, 6.39, 6.67, -, 57.00%, 75.00%, -, 61.10%, 13.40%, -20.60%, -56.60%, -28.90%, 1.50, 1.30, 0.53, 0.87, 61.00%, -36.80%, -41.30%, -20.00%, -45.74%, 20.69%, 30.84%, 12.00%, 6.11%
137, MEOH, Methanex Corporation, Basic Materials, Chemicals, Canada, 2.82B, 20.12, -, 0.97, 2.13, 7.94, -279.70%, -44.43%, 28.70%, 358.70%, 36.30%, -1.30%, -6.10%, 0.20%, 2.10, 1.70, 2.29, 2.40, 14.30%, 2.10%, -2.60%, -4.77%, -8.38%, -14.79%, 120.67%, -22.85%, 3.76%
139, METC, Ramaco Resources Inc., Basic Materials, Coking Coal, USA, 257.08M, 9.43, -, 1.51, 1.43, -, -118.90%, 62.23%, 4.23%, 103.00%, 3.80%, -1.10%, -1.60%, -8.40%, 1.70, 1.00, 0.09, 0.12, 14.50%, -11.10%, -1.60%, 43.39%, 21.05%, 79.69%, 112.18%, 99.65%, 7.18%
142, MMX, Maverix Metals Inc., Basic Materials, Other Precious Metals & Mining, Canada, 804.88M, 36.62, -, 14.50, 2.28, -, 346.60%, 12.14%, -, -, 40.90%, 10.70%, 12.20%, 3.80%, 11.30, 11.30, 0.00, 0.00, 56.90%, 46.70%, 67.80%, -4.17%, 17.83%, 13.19%, 23.66%, 5.31%, 4.28%
144, MP, MP Materials Corp., Basic Materials, Other Industrial Metals & Mining, USA, 4.79B, 40.34, -, 24.65, 5.42, -, -, 35.41%, 54.02%, 2225.40%, 100.40%, -0.60%, -1.00%, -1.80%, 17.00, 16.50, 0.79, 0.84, 56.70%, -, -2.90%, -11.53%, -39.22%, 25.98%, -, -12.71%, 7.21%
146, MT, ArcelorMittal, Basic Materials, Steel, Luxembourg, 35.67B, 7.16, -, 0.65, 0.96, 16.79, 73.50%, -42.10%, -, 274.50%, 9.10%, 3.20%, 7.10%, 0.90%, 1.30, 0.70, 0.21, 0.28, -, 9.30%, 4.90%, 6.50%, 34.45%, 77.31%, 238.77%, 42.31%, 2.82%
148, MTL, Mechel PAO, Basic Materials, Steel, Russia, 653.80M, -, -, 0.18, -, 1.56, -547.50%, -, -, 124.00%, 13.10%, 23.00%, -18.70%, 25.50%, 0.20, 0.10, -, -, 36.60%, 9.50%, 16.70%, 13.64%, 20.97%, 49.01%, 24.31%, 9.76%, 6.07%
150, MTX, Minerals Technologies Inc., Basic Materials, Chemicals, USA, 2.92B, 15.94, 4.66, 1.79, 2.01, 11.97, -13.10%, 11.32%, 5.60%, 4.60%, 8.40%, 3.60%, 7.90%, 6.80%, 3.60, 2.80, 0.64, 0.64, 25.20%, 11.60%, 7.00%, 9.19%, 17.46%, 38.67%, 76.43%, 40.05%, 2.62%
152, NAK, Northern Dynasty Minerals Ltd., Basic Materials, Other Industrial Metals & Mining, Canada, 293.30M, -, -, -, 2.08, -, 30.20%, -, -, 24.60%, -, -34.70%, -37.20%, -, 4.70, 4.70, 0.00, 0.00, -, -, -, -5.12%, -28.76%, 40.56%, -56.71%, 74.78%, 5.51%
154, NEU, NewMarket Corporation, Basic Materials, Specialty Chemicals, USA, 3.70B, -, 1.91, 1.83, 4.62, 40.04, 8.40%, -, 7.70%, -16.80%, 1.30%, 12.70%, 34.70%, 18.30%, 4.00, 2.80, 1.22, 0.00, 28.50%, 14.40%, 12.60%, -2.17%, -11.02%, -8.60%, -21.30%, -13.82%, 1.83%
156, NG, NovaGold Resources Inc., Basic Materials, Gold, Canada, 3.38B, -, -, -, 32.06, -, -19.60%, 0.00%, -, -19.50%, -, -15.40%, -30.70%, -, 119.00, 119.00, 1.06, 1.06, -, -, -, 11.89%, 23.02%, 3.22%, 7.32%, 6.10%, 3.54%
158, NGVT, Ingevity Corporation, Basic Materials, Specialty Chemicals, USA, 3.33B, 13.60, 5.93, 2.67, 5.03, 12.64, 0.30%, 12.20%, 3.10%, 10.80%, 11.10%, 8.10%, 30.30%, 9.40%, 2.90, 2.00, 1.91, 1.94, 38.20%, 19.30%, 14.80%, 5.54%, 15.02%, 19.86%, 56.27%, 8.69%, 2.96%
160, NTIC, Northern Technologies International Corporation, Basic Materials, Specialty Chemicals, USA, 147.33M, 17.35, -, 3.25, 2.52, 122.78, -126.60%, 69.64%, 20.00%, 599.70%, -3.00%, -0.20%, -0.30%, -1.90%, 4.70, 3.30, 0.00, 0.00, 33.90%, 6.10%, -0.30%, 8.14%, -4.19%, 73.47%, 122.44%, 56.06%, 5.00%
141, MLM, Martin Marietta Materials Inc., Basic Materials, Building Materials, USA, 23.12B, 26.32, 2.47, 4.86, 3.82, 36.83, 18.50%, 11.80%, 12.10%, 151.70%, 2.50%, 7.30%, 13.20%, 9.80%, 3.70, 2.20, 0.44, 0.00, 27.00%, 22.00%, 16.00%, 1.28%, 4.63%, 33.36%, 89.31%, 28.06%, 2.29%
143, MOS, The Mosaic Company, Basic Materials, Agricultural Inputs, USA, 13.67B, 14.17, 1.95, 1.49, 1.42, 31.06, 160.60%, -17.13%, 7.00%, 168.00%, 27.80%, 5.30%, 11.30%, 6.80%, 1.10, 0.60, 0.41, 0.47, 15.90%, 8.60%, 11.20%, -0.44%, 17.68%, 60.12%, 198.92%, 57.06%, 4.05%
145, MSB, Mesabi Trust, Basic Materials, Steel, USA, 488.33M, -, -, 18.78, 29.54, -, -22.10%, -, -, 96.60%, 92.90%, 138.20%, 198.30%, 141.90%, 3.60, 3.60, 0.00, 0.00, -, 90.00%, 90.20%, 4.55%, 34.51%, 57.05%, 93.75%, 32.69%, 3.62%
147, MTA, Metalla Royalty & Streaming Ltd., Basic Materials, Other Precious Metals & Mining, Canada, 449.05M, -, -, 200.01, -, -, -, -, -5.60%, -, 182.20%, -, -, -, -, -, -, -, -, -, -, 10.59%, 27.19%, 20.76%, 81.45%, -14.33%, 4.77%
149, MTRN, Materion Corporation, Basic Materials, Other Industrial Metals & Mining, USA, 1.62B, 19.34, 3.83, 1.29, 2.43, 113.04, -71.00%, 29.14%, 12.00%, 527.20%, 27.50%, 3.30%, 5.60%, 2.10%, 3.40, 1.50, 0.11, 0.11, 17.10%, 2.60%, 2.80%, 9.01%, 7.69%, 30.61%, 50.19%, 23.74%, 2.73%
151, MUX, McEwen Mining Inc., Basic Materials, Other Precious Metals & Mining, Canada, 674.99M, 73.50, -, 6.95, 1.65, -, -128.70%, 133.30%, -, 88.60%, -24.50%, -12.90%, -17.20%, -35.20%, 1.80, 1.20, 0.12, 0.00, -29.10%, -63.50%, -67.50%, 17.60%, 37.38%, 50.38%, 62.65%, 49.24%, 5.66%
153, NEM, Newmont Corporation, Basic Materials, Gold, USA, 58.56B, 19.02, 3.05, 4.97, 2.55, 26.01, -15.30%, 9.99%, 8.20%, -35.20%, 11.30%, 6.30%, 11.30%, 6.50%, 2.40, 1.90, 0.24, 0.29, 58.20%, 27.20%, 21.80%, 17.93%, 34.46%, 27.17%, 25.67%, 22.69%, 2.29%
155, NEXA, Nexa Resources S.A., Basic Materials, Other Industrial Metals & Mining, Luxembourg, 1.37B, 8.61, -, 0.65, 1.08, 14.88, -285.90%, -6.55%, -, 104.40%, 36.40%, -0.30%, -1.10%, -11.00%, 1.90, 1.60, 1.37, 1.46, 24.40%, 10.90%, -0.70%, 1.91%, 12.53%, 32.80%, 165.26%, 10.89%, 5.06%
157, NGD, New Gold Inc., Basic Materials, Gold, Canada, 1.41B, 7.69, -, 2.12, 1.73, 58.53, 2.50%, 44.27%, 5.00%, 152.80%, 15.90%, -1.50%, -4.30%, 3.30%, 2.60, 1.90, 0.60, 0.61, 77.80%, 11.70%, -5.40%, 26.04%, 32.30%, 21.71%, 76.03%, -2.74%, 4.94%
159, NP, Neenah Inc., Basic Materials, Paper & Paper Products, USA, 898.22M, 12.79, -, 1.14, 2.46, 18.29, -129.20%, 40.10%, 5.00%, -49.20%, -2.80%, -2.80%, -6.60%, -0.60%, 2.00, 1.30, 0.52, 0.53, 18.90%, -2.00%, -3.10%, -0.60%, -6.71%, 10.27%, 4.69%, -4.32%, 2.41%
162, NUE, Nucor Corporation, Basic Materials, Steel, USA, 30.24B, 17.61, 2.14, 1.40, 2.70, -, -42.90%, -55.27%, 8.88%, 4535.40%, 24.80%, -, -, 6.20%, 3.50, 2.00, 0.46, 0.47, 15.00%, -, -, 24.43%, 66.68%, 87.19%, 142.64%, 92.78%, 4.09%
164, OEC, Orion Engineered Carbons S.A., Basic Materials, Specialty Chemicals, Luxembourg, 1.24B, 10.05, 14.25, 1.07, 6.06, 1380.14, -79.10%, 14.70%, 3.70%, 31.80%, 7.20%, 1.70%, 13.70%, 7.20%, 1.50, 1.10, 3.46, 4.01, 26.30%, 6.90%, 2.00%, -0.10%, 7.95%, 25.56%, 83.00%, 18.09%, 3.88%
166, OR, Osisko Gold Royalties Ltd, Basic Materials, Gold, Canada, 2.39B, -, -, 11.20, 1.38, -, -, -, -, -, 26.50%, -, -, -, -, -, -, -, -, -, -, 17.79%, 44.88%, 35.55%, 44.74%, 12.78%, 2.91%
168, OSN, Ossen Innovation Co. Ltd., Basic Materials, Steel, China, 30.92M, -, -, 0.22, 0.23, -, -0.10%, -, -, 3.30%, 26.60%, 5.90%, 9.20%, 8.70%, 5.20, 4.10, 0.05, 0.26, 17.10%, 11.80%, 8.00%, -2.52%, -4.15%, 4.81%, 128.91%, -2.52%, 2.21%
170, PKX, POSCO, Basic Materials, Steel, South Korea, 28.11B, 8.87, 2.48, 0.53, 0.60, 4.11, -11.60%, 6.36%, 5.00%, 174.20%, 10.50%, 2.70%, 5.00%, 3.10%, 2.20, 1.60, 0.29, 0.50, 9.40%, 5.20%, 3.70%, -4.51%, 25.80%, 44.13%, 117.04%, 28.57%, 1.91%
172, PLL, Piedmont Lithium Limited, Basic Materials, Other Industrial Metals & Mining, Australia, 1.02B, -, -, -, 11.39, -, -, -, -, -, -, -, -, -, -, -, -, -, -, -, -, -10.32%, -3.38%, 128.76%, 801.33%, 144.44%, 6.70%
174, PPG, PPG Industries Inc., Basic Materials, Specialty Chemicals, USA, 42.84B, 20.25, 3.87, 2.99, 7.31, 30.71, -14.90%, 10.26%, 9.30%, 54.70%, 14.90%, 6.30%, 22.00%, 10.00%, 1.40, 1.10, 0.91, 1.06, 43.50%, 11.40%, 8.30%, 3.77%, 30.37%, 22.52%, 76.77%, 24.62%, 1.68%
176, PQG, PQ Group Holdings Inc., Basic Materials, Specialty Chemicals, USA, 2.24B, 27.01, -, 2.57, 1.87, 14.45, -370.60%, 51.25%, 4.17%, 18.40%, 0.80%, -10.00%, -24.60%, -5.20%, 1.90, 1.70, 1.18, 1.18, 24.60%, -23.70%, -42.60%, 16.63%, -1.51%, 39.69%, 48.48%, 14.59%, 2.91%
178, PZG, Paramount Gold Nevada Corp., Basic Materials, Gold, USA, 40.00M, -, -, 133.32, 0.81, -, -1.00%, -20.00%, -, 28.10%, -, -11.50%, -13.00%, -, 9.50, 9.50, 0.09, 0.09, -, -, -, 3.88%, -0.93%, 1.80%, -4.46%, -8.55%, 2.89%
180, RFP, Resolute Forest Products Inc., Basic Materials, Paper & Paper Products, Canada, 1.37B, 9.23, 67.91, 0.46, 1.16, 3.55, 122.50%, -63.75%, 0.21%, -, 26.70%, 2.60%, 8.10%, 3.80%, 2.30, 1.10, 0.41, 0.41, 32.70%, 10.00%, 3.30%, 28.09%, 77.21%, 201.25%, 806.99%, 157.95%, 7.42%
161, NTR, Nutrien Ltd., Basic Materials, Agricultural Inputs, Canada, 35.44B, 20.44, -, 1.73, 1.59, -, -, 29.90%, -, -, 11.90%, -, -, -, -, -, -, -, -, -, -, 10.65%, 11.60%, 27.91%, 82.79%, 29.05%, 2.40%
163, ODC, Oil-Dri Corporation of America, Basic Materials, Specialty Chemicals, USA, 269.74M, -, -, 0.92, 1.70, 29.64, 55.00%, -, -, -48.10%, -47.60%, 8.30%, 12.60%, 13.00%, 2.90, 2.30, 0.06, 0.06, 25.90%, 8.30%, 6.50%, 4.82%, 2.55%, 1.47%, 3.16%, 7.25%, 1.98%
165, OLN, Olin Corporation, Basic Materials, Specialty Chemicals, USA, 7.84B, 9.41, -, 1.25, 4.57, 23.28, 575.70%, -1.59%, 2.30%, 398.80%, 34.60%, -7.60%, -38.00%, -13.10%, 1.70, 1.10, 2.18, 2.21, 13.20%, -5.10%, -10.30%, 11.01%, 53.45%, 111.46%, 306.40%, 99.06%, 4.16%
167, ORLA, Orla Mining Ltd., Basic Materials, Gold, Canada, 1.16B, -, -, -, -, -, -, -, -, -, -, -, -, -, -, -, -, -, -, -, -, 31.81%, 44.25%, 2.98%, 100.87%, -9.28%, 6.15%
169, PAAS, Pan American Silver Corp., Basic Materials, Silver, Canada, 7.11B, 13.91, 1.67, 5.27, 2.74, 45.30, 54.00%, 84.94%, 17.14%, 89.90%, 2.70%, 7.40%, 9.90%, 5.10%, 2.60, 1.20, 0.01, 0.01, 29.70%, 20.20%, 18.30%, 3.86%, 5.06%, 15.36%, 14.81%, -2.52%, 4.28%
171, PLG, Platinum Group Metals Ltd., Basic Materials, Other Precious Metals & Mining, Canada, 311.30M, -, -, -, 145.33, -, 77.50%, -, -, -10.60%, -, -26.10%, 100.10%, -, 8.70, 8.70, 11.72, 0.00, -, -, -, -14.00%, 6.60%, 93.78%, 190.67%, -6.03%, 6.56%
173, PLM, PolyMet Mining Corp., Basic Materials, Other Industrial Metals & Mining, USA, 296.40M, -, -, -, 0.84, -, 76.00%, 0.00%, 20.00%, 50.20%, -, -3.70%, -4.60%, -, 0.40, 0.40, 0.07, 0.12, -, -, -, 4.45%, -33.41%, -15.98%, 25.10%, -10.56%, 4.28%
175, PPTA, Perpetua Resources Corp., Basic Materials, Other Precious Metals & Mining, USA, 366.88M, -, -, -, -, -, -, -, -, -, -, -, -, -, -, -, -, -, -, -, -, 3.21%, 20.62%, -12.57%, 80.02%, -18.74%, 5.31%
177, PVG, Pretium Resources Inc., Basic Materials, Gold, Canada, 2.14B, 22.80, -, 3.47, 2.30, -, 116.70%, 733.30%, -, -, 25.20%, -, -, -, -, -, -, -, -, -, -, 6.44%, 17.77%, 2.33%, 30.73%, -0.70%, 3.60%
179, RETO, ReTo Eco-Solutions Inc., Basic Materials, Building Materials, China, 28.21M, -, -, 2.91, 1.00, 35.26, -10.70%, -, -, -390.70%, -77.50%, -17.00%, -32.60%, -32.40%, 0.60, 0.50, 0.23, 0.58, 11.90%, -, -, -5.13%, -37.29%, 71.43%, 4.73%, 67.04%, 9.32%
182, RIO, Rio Tinto Group, Basic Materials, Other Industrial Metals & Mining, United Kingdom, 141.43B, 8.68, -, 3.17, 3.01, 39.80, 23.00%, -24.89%, -7.10%, -26.80%, 22.50%, 11.00%, 23.50%, 18.90%, 1.80, 1.50, 0.28, 0.29, -, 37.00%, 21.90%, -0.11%, -1.63%, 33.27%, 63.82%, 17.43%, 2.05%
184, RPM, RPM International Inc., Basic Materials, Specialty Chemicals, USA, 12.14B, 20.70, 1.71, 2.09, 7.76, 19.17, 20.00%, 8.35%, 15.65%, 222.80%, 8.10%, 9.10%, 36.00%, 10.70%, 2.30, 1.40, 1.49, 1.49, 38.90%, 13.00%, 9.00%, -1.18%, 15.34%, 7.41%, 25.07%, 3.03%, 1.65%
186, RYAM, Rayonier Advanced Materials Inc., Basic Materials, Chemicals, USA, 508.13M, -, -, 0.28, 0.74, 5.57, 99.90%, -314.30%, -, -8.10%, 13.50%, -0.10%, -0.30%, 3.70%, 2.30, 1.30, 1.62, 1.64, 11.20%, 4.80%, -0.10%, -17.26%, -27.85%, 17.50%, 255.76%, 18.40%, 7.76%
188, SAND, Sandstorm Gold Ltd., Basic Materials, Gold, Canada, 1.69B, 108.88, -, 16.50, 2.72, -, 40.00%, 14.30%, -, -, 45.30%, -, -, -, -, -, -, -, -, -, -, 14.91%, 44.21%, 20.14%, 4.44%, 21.48%, 3.47%
190, SCCO, Southern Copper Corporation, Basic Materials, Copper, USA, 53.49B, 18.32, 2.11, 6.08, 7.17, 50.79, 5.70%, -9.21%, 12.06%, 255.60%, 47.30%, 12.80%, 29.70%, 14.10%, 3.70, 3.00, 0.87, 0.00, 57.10%, 44.80%, 24.10%, -3.15%, -6.88%, 16.27%, 92.12%, 7.09%, 3.78%
192, SCL, Stepan Company, Basic Materials, Specialty Chemicals, USA, 3.03B, 18.00, 5.09, 1.55, 3.09, 15.12, 23.20%, 9.67%, 4.40%, 47.20%, 19.50%, 8.30%, 14.60%, 10.80%, 1.70, 1.20, 0.16, 0.25, 21.10%, 9.50%, 7.10%, 2.47%, 9.46%, 13.63%, 38.60%, 12.86%, 2.04%
194, SHW, The Sherwin-Williams Company, Basic Materials, Specialty Chemicals, USA, 76.00B, 27.52, 3.51, 4.03, 24.48, 27.43, 33.90%, 10.50%, 10.45%, 31.10%, 12.30%, 10.30%, 57.40%, 16.90%, 0.90, 0.60, 2.55, 2.96, 47.20%, 13.90%, 11.20%, 3.69%, 22.59%, 16.32%, 43.23%, 15.74%, 1.56%
196, SILV, SilverCrest Metals Inc., Basic Materials, Other Industrial Metals & Mining, Canada, 1.43B, 0.55, -, -, 8.60, -, 3.90%, 2.40%, -, -, -, -, -, -, -, -, -, -, -, -, -, 12.36%, 23.87%, 14.97%, 10.97%, -11.36%, 4.84%
198, SMG, The Scotts Miracle-Gro Company, Basic Materials, Agricultural Inputs, USA, 12.00B, 23.05, 2.26, 2.42, 12.87, -, -12.70%, 3.09%, 10.10%, 23.00%, 32.30%, 13.40%, 65.40%, 20.80%, 1.90, 1.20, 2.47, 2.69, 32.80%, 15.20%, 10.90%, -8.34%, -3.30%, 28.31%, 56.95%, 9.15%, 2.99%
200, SMTS, Sierra Metals Inc., Basic Materials, Other Industrial Metals & Mining, Canada, 587.75M, 51.57, -, 2.38, 2.92, -, -, 333.30%, -, 67.70%, 17.90%, -, -, -, -, -, -, -, -, -, -, -1.90%, 32.72%, 23.63%, 353.29%, 8.73%, 5.87%
181, RGLD, Royal Gold Inc., Basic Materials, Gold, USA, 8.15B, 33.74, 2.80, 14.35, 3.34, 47.23, 34.70%, 8.46%, 14.70%, 40.10%, 4.50%, 9.70%, 11.40%, 5.10%, 7.10, 6.90, 0.06, 0.06, 83.40%, 52.20%, 47.50%, 8.58%, 19.35%, 13.03%, -7.08%, 16.37%, 2.55%
183, RKDA, Arcadia Biosciences Inc., Basic Materials, Agricultural Inputs, USA, 60.19M, -, -, 7.52, 1.14, -, 89.70%, 13.80%, 14.96%, 211.00%, 1613.90%, -52.40%, -127.40%, -43.00%, 5.00, 4.40, 0.08, 0.12, 87.10%, -, -, 4.81%, -12.65%, -14.24%, -22.25%, 11.86%, 6.69%
185, RS, Reliance Steel & Aluminum Co., Basic Materials, Steel, USA, 10.72B, 13.73, 1.84, 1.18, 2.00, 12.81, -45.30%, -18.80%, 10.29%, 349.50%, 10.30%, 7.10%, 11.20%, 6.80%, 4.40, 2.60, 0.31, 0.31, 32.50%, 9.30%, 6.30%, 2.72%, 20.63%, 38.42%, 73.27%, 40.35%, 2.77%
187, SA, Seabridge Gold Inc., Basic Materials, Gold, Canada, 1.47B, -, -, -, 2.75, -, -20.90%, -22.20%, -, -14.90%, -, -2.80%, -3.00%, -, 4.30, 4.30, 0.00, 0.00, -, -, -, 10.58%, 13.61%, 5.75%, 23.28%, -9.25%, 3.39%
189, SBSW, Sibanye Stillwater Limited, Basic Materials, Gold, South Africa, 13.41B, 4.63, -, 1.45, 2.57, 10.52, -, 5.01%, -, 728.90%, 170.60%, 25.80%, 68.30%, 39.90%, 3.00, 1.60, 0.26, 0.27, 33.20%, 31.20%, 23.00%, -4.41%, -2.28%, 40.00%, 150.82%, 15.86%, 3.24%
191, SCHN, Schnitzer Steel Industries Inc., Basic Materials, Steel, USA, 1.51B, 9.07, 2.71, 0.77, 2.09, -, -107.30%, -1.40%, 10.00%, 1048.30%, 36.50%, 4.30%, 8.40%, 0.90%, 1.90, 1.00, 0.23, 0.23, 15.00%, 4.50%, 2.90%, 14.43%, 46.45%, 105.51%, 247.01%, 70.73%, 4.73%
193, SEED, Origin Agritech Limited, Basic Materials, Agricultural Inputs, China, 66.07M, -, -, 8.06, -, -, -14.20%, -, -, 54.40%, -9.70%, -31.80%, 368.60%, -161.60%, 0.40, 0.30, -, -, 6.70%, -, -, -24.21%, -50.60%, 16.08%, 217.31%, -23.96%, 8.81%
195, SID, Companhia Siderurgica Nacional, Basic Materials, Steel, Brazil, 11.91B, 4.86, 1.65, 1.70, 4.29, 6.01, 112.10%, -37.51%, 3.60%, 485.10%, 123.30%, 17.00%, 124.30%, 11.10%, 1.80, 1.50, 2.15, 2.41, 41.90%, 34.90%, 28.40%, -9.06%, 41.93%, 95.19%, 351.32%, 43.36%, 3.82%
197, SIM, Grupo Simec S.A.B. de C.V., Basic Materials, Steel, Mexico, 3.64B, -, -, 1.78, 1.97, 30.52, -147.10%, -, -, 38.20%, 57.10%, 10.20%, 14.20%, -2.90%, 3.00, 2.00, 0.00, 0.00, 20.80%, 17.30%, 12.00%, 52.70%, 61.83%, 121.76%, 197.11%, 65.63%, 10.34%
199, SMID, Smith-Midland Corporation, Basic Materials, Building Materials, USA, 87.86M, -, -, 1.78, 3.47, 10.71, 35.70%, -, -, -3.90%, 55.10%, 11.90%, 23.70%, 8.40%, 2.40, 2.20, 0.23, 0.28, 30.80%, 15.50%, 11.30%, 45.37%, 41.33%, 113.42%, 285.87%, 87.83%, 4.81%
202, SPPP, Sprott Physical Platinum and Palladium Trust, Basic Materials, Other Precious Metals & Mining, Canada, -, -, -, -, -, -, -, -, -, -, -, -, -, -, -, -, -, -, -, -, -, -4.17%, 13.64%, 22.47%, 40.65%, 12.23%, 2.03%
204, SSRM, SSR Mining Inc., Basic Materials, Gold, Canada, 4.10B, 9.75, -, 3.89, 1.17, 17.47, 73.70%, 8.56%, -, 17.70%, 122.80%, 3.80%, 5.70%, 4.10%, 6.00, 4.20, 0.12, 0.14, 39.00%, 28.00%, 15.40%, 15.94%, 33.07%, 4.51%, -3.54%, -7.76%, 3.95%
206, SUM, Summit Materials Inc., Basic Materials, Building Materials, USA, 4.05B, 24.15, 1.14, 1.69, 2.51, 16.79, 129.60%, 21.07%, 21.80%, 50.80%, 16.50%, 3.80%, 10.40%, 6.60%, 2.70, 2.00, 1.20, 1.21, 31.30%, 10.60%, 6.70%, 18.96%, 23.96%, 78.02%, 129.23%, 73.41%, 3.83%
208, SVM, Silvercorp Metals Inc., Basic Materials, Silver, Canada, 1.13B, 21.50, 4.92, 5.87, 2.42, 15.25, 33.00%, -9.91%, 5.00%, 122.60%, 88.90%, 7.50%, 10.50%, 12.50%, 5.90, 5.70, 0.00, 0.00, 50.00%, 37.30%, 24.10%, 21.01%, 15.18%, 10.07%, 45.93%, -3.59%, 4.77%
